Abstract,Authors,Classification,DOI,Keywords,Not Identified,Not identified,Operational,Out of Scope,Publisher,Reasons,Source,Strategic,Tactical,Title,Year
"In today's fiercely competitive business landscape, startups face numerous challenges in achieving scalability and sustainability. The integration of cutting-edge technologies such as Artificial Intelligence (AI), blockchain, and the Internet of Things (IoT) presents promising solutions to these challenges. However, understanding the intricacies of technology acceptance within the startup environment becomes paramount. Technology Acceptance Models (TAMs) have long served as foundational frameworks for understanding technology adoption and integration, but their effectiveness is hindered by inherent limitations. These limitations demand further exploration, particularly when viewed through the entrepreneurial lens. This paper offers a comprehensive analysis of the strengths and limitations inherent in TAM and its extensions, alongside other prominent technology acceptance models. By incorporating an entrepreneurial perspective, the analysis reveals additional challenges stemming from the dynamic nature of startup ecosystems. From a pragmatic standpoint, this paper provides actionable insights for technology-driven entrepreneurial organizations to navigate innovation and technology adoption decisions more intelligently. From a theoretical perspective, it contributes to the refinement and evolution of technology acceptance models, particularly in the context of entrepreneurial ventures. In light of these limitations, the paper offers strategic recommendations for future research endeavors. These include encouraging interdisciplinary collaboration, contextualizing models to suit startup dynamics, conducting longitudinal studies to capture evolving user perceptions, accounting for individual differences in technology adoption, and validating emerging models to reflect contemporary realities. Emphasis is placed on the entrepreneurial imperative of agility and adaptability in navigating the ever-changing landscape of technology acceptance. Moreover, the paper underscores the importance of a multidisciplinary approach and delineates practical implications for organizations and practitioners aiming to sustain technology acceptance and successful implementation within dynamic startup environments. By addressing these constraints, researchers can pave the way for the development of more robust and comprehensive models, better equipped to clarify and predict technology acceptance and usage patterns. Ultimately, this research underscores the critical need for ongoing refinement and innovation within the realm of technology acceptance, providing actionable insights to propel both scholarly discourse and entrepreneurial practice forward.","Rahimi, RA; Oh, GS",Strategic,10.1057/s41270-024-00318-x,Technology acceptance model; Entrepreneurship; Limitations; Startup environment; Innovation adoption,10.0,,5,0,PALGRAVE MACMILLAN LTD,"The abstract discusses the long-term implications of technology acceptance models (TAMs) in the context of startups, focusing on the need for refinement and innovation to support strategic organizational goals in a dynamic environment.",wos-ai,70,15,Beyond theory: a systematic review of strengths and limitations in technology acceptance models through an entrepreneurial lens,2024
"For many professional services, advice adherence is a necessary condition for achieving service success for both customers and service providers. Despite their pivotal roles in value co-creation, typical conversational interactions often lead to low adherence. We propose that enabling a dominance transition, from provider dominance in the pre-advice stage to customer dominance in the post-advice stage, enhances advice adherence because it increases customers' perceived common ground. Furthermore, providers' consultation focus, customers' prior knowledge, and customers' perceived adherence effort moderate this process. Using mixed methods, including both empirical modeling and controlled and field experiments, we validate the proposed model in various contexts (healthcare, financial services, and fitness and wellness counseling). The findings establish several theoretical contributions and offer managerial implications for improving advice adherence by managing dominance transitions in conversational interactions more effectively through training service providers or even programming AI chatbots.","Wang, HS; Yim, CK",Out of scope,10.1007/s11747-019-00664-8,Advice adherence; Professional service conversations; Conversational dominance; Dominance transitions; Customers' perceived common ground,5.0,,10,70,SPRINGER,"The abstract discusses advice adherence in professional services such as healthcare, financial services, and fitness, which are not directly related to marketing.",wos-ai,5,10,Effects of dominance transitions on advice adherence in professional service conversations,2019
"Despite being critical to continuous technology usage, research on remote mobile payments (m-payments) post-adoption usage has received much less attention. Furthermore, information systems usage research has traditionally been positively oriented, generally assuming that the inhibiting and enabling factors influencing technology usage as being the opposite sides of one dimension, which may result in overlooking antecedents to technology continuance. Therefore, this study aims to explore the inhibiting factors that may directly influence customers' intention to discontinue m-payments during post-adoption usage. Drawing on behavioral theories, information systems, and marketing research, this study explores the inhibiting factors directly influencing consumers' intentions to discontinue using m-payments. Survey data were collected from 254 current users in the UK and the PLS-SEM technique is employed to test hypotheses. The results show that poor quality of system, information, and service, as usage inhibitors, directly influence consumers' discontinuance intentions. Importantly, usage frequency is found to have no moderating effect on the inhibitors of continuance intention, supporting the notion about different and asymmetric effects that negative factors can have on technology usage compared to positive ones. This interesting finding suggests that negative user experience will have different and asymmetric effects on intentions to use m-payments than positive user experience.","Koghut, M; AI-Tabbaa, O",Tactical,10.3390/admsci11010018,mobile payment; discontinuance intention; usage inhibitors; information system success model; asymmetric effect,5.0,,15,0,MDPI,"The study explores specific factors influencing consumers' intentions regarding the discontinuance of mobile payments, which aligns with tactical decision-making focused on concrete targets and structured decisions in marketing.",wos-ai,10,70,Exploring Consumers' Discontinuance Intention of Remote Mobile Payments during Post-Adoption Usage: An Empirical Study,2021
"Purpose The decision concerning the degree of product and service customization is crucial, yet has scarcely been studied for small businesses in business-to-business (B2B) contexts. Although such a decision allows relationships with potential customers to be strengthened, it might involve high opportunity costs given the investment required. This paper aims to analyse the profitability of customization undertaken by small businesses in terms of cost-benefit and examine the drivers of profitable customized projects vis-a-vis the ability to strengthen relationships with clients (relationship investment and customer involvement) and the firm's resources related to processes and technology (expertise and modularity). Design/methodology/approach To test the proposed hypotheses, data were collected from 140 small Spanish firms involved in two sectors characterized by the offer of customized solutions: information and professional, scientific and technical services. Findings Analysis reveals that customer involvement in the customized solution, even when it requires investing in equipment, time or human resources has a positive effect on customization and ultimately on profitability, as the cost of this customer interaction is lower than the revenue it provides. Likewise, supplier investment in the relationship allows for a solution that is adapted to the client, although it requires a cost associated with investing in specific assets. Such costs cancel out the positive indirect effect through the customized solution. Finally, expertise enables appropriate use of the flexibility derived from modularity to satisfy customer requirements, with both being key company resources for driving profitability through customized solutions. Originality/value This study makes a contribution to the domain of customization. The authors extend current knowledge on B2B customization by proving that small firms can use their available capabilities and knowledge to achieve a successful customization strategy.","Rodríguez-Escudero, AI; Camarero-Izquierdo, C; Redondo-Carretero, M",Strategic,10.1108/JBIM-03-2021-0147,Customization; Small businesses; Relationship investment; Expertise; Modularity,5.0,,10,0,EMERALD GROUP PUBLISHING LTD,"The abstract discusses the long-term implications of customization decisions in small businesses and their impact on profitability and customer relationships, which aligns with strategic planning and goals.",wos-ai,60,25,"Towards profitable customized solutions in small firms: a matter of relationships, modularity and expertise",2023
"This research aims to analyze the relationships between three dimensions of the market entry strategy for new products - order, positioning and scope - and four dimensions of performance - customer satisfaction, competitive position, costs and profitability. The consideration of internal links between the entry dimensions, together with their effect on the different performance variables, will enable us to determine the existence of mediating effects, which up until now have barely been examined in the literature. We test our model on a cross-sectional sample of 136 manufacturing firms, applying structural equation modeling based on the Partial Least Squares (PLS) methodology. Our findings reveal that all the three strategic decisions included in our model of market entry do affect performance, although their influence changes according to the performance dimension being measured. (C) 2007 Elsevier Inc. All tights reserved.","Rodríguez-Pinto, J; Rodríguez-Escudero, AI; Gutiérrez-Cillán, J",Strategic,10.1016/j.indmarman.2006.12.002,order-of-entry; positioning; market scope; performance,10.0,,10,0,ELSEVIER SCIENCE INC,"The research focuses on analyzing market entry strategies and their impact on performance, which aligns with long-term organizational goals and strategic planning.",wos-ai,60,20,"Order, positioning, scope and outcomes of market entry",2008
"Purpose - The current research aims to analyze antecedents and consequences of using the information provided by customers involved in new service development (NSD). It also seeks to examine the moderating effect of technological turbulence on the antecedents and consequences of information use. Design/methodology/approach - Data were collected from service firms in a variety of industrial sectors. Unit of analysis was a NSD project in which current or potential customers were involved during its development process. A self-administered mail survey was used to collect the data. A total of 102 complete questionnaires were returned. The proposed model was tested using partial least squares. Findings - The results indicate that the instrumental use of the information collected from customers involved in NSD can lead to higher service advantage and service newness and in turn to higher market performance. Findings reveal that higher recording and reviewing of information collected from customers involved in NSD result in greater use of the information during the NSD process. An important result is that under technologically turbulent environments, recording and reviewing information from customers involved in NSD is less likely to result in a higher instrumental use of such information. Finally, the authors' results show that when technological turbulence is high the instrumental use of information from customers involved in NSD has lower value for both service advantage and service newness. Originality/value - Findings confirm the importance of customer involvement for NSD in a business context. Using the information from customers involved in NSD to resolve specific problems or make decisions regarding NSD projects can result in enhanced service performance. Moreover, information processing capabilities are key antecedents to instrumental information use. Finally, managers should be aware of the potential negative effect of technological turbulence.","Carbonell, P; Rodriguez-Escudero, AI",Tactical,10.1108/JBIM-04-2012-0071,New service development; Customer involvement; Information processing behaviors; Information use; New service performance; Technological turbulence,5.0,,15,0,EMERALD GROUP PUBLISHING LTD,"The research focuses on the use of customer information in new service development (NSD) and its implications for service advantage and market performance, which aligns with interpreting strategic goals into structured targets. It emphasizes practical decision-making and processes related to product development and customer engagement.",wos-ai,20,60,Antecedents and consequences of using information from customers involved in new service development,2014
"Purpose This paper aims to develop a theoretical framework based on transaction cost economics that identifies key factors shaping public agencies' governance of supplier relationships and related performance implications. Design/methodology/approach The paper presents an extended transaction cost framework for research on public procurement (PP) with a corresponding set of propositions. Transaction cost theory and specific features of and challenges to the PP function identified in extant literature constitute the main elements of the framework. Findings This conceptual paper makes three sets of proposals. First, public agencies tend to rely on market governance of supplier relationships and when PP deploys non-market governance, such governance tends to be of a unilateral (vs bilateral) kind. Second, increases in purchasing competence and autonomy of PP and particularly if implemented in tandem, will reduce PP's overreliance on market governance and increase PP's use of non-market governance. Third, PP should perform better for less complex transactions - and when contracting complexity relates to safeguarding of specific assets rather than when complexity relates to environmental and behavioral uncertainty. Increases in competence and autonomy should increase PP's performance, particularly for complex transactions. Practical implications Public agencies may be in a better position to align governance solutions with transaction complexities by developing their procurement competence, decentralizing procurement decisions and increasing the flexibility of national and international procurement regulations. Private companies selling to public agencies need to be aware of and able to adapt to PP practices such as extensive use of market governance and unilateral governance as the primary form of non-market governance. Social implications The paper discusses how public agencies can improve procurement performance through better alignment of governance of supplier relationships with transaction attributes and thereby increase the quality of public services. Originality/value The paper relies on a well-established theoretical perspective, enabling identification (and, potentially, correction) of governance misalignment in the public sector.","Rokkan, AI; Haugland, SA",Strategic,10.1108/JBIM-09-2019-0393,Public sector; Governance; Procurement; Transaction costs,5.0,,10,0,EMERALD GROUP PUBLISHING LTD,"The paper develops a theoretical framework that aims to improve public procurement governance and performance, addressing long-term implications and aligning governance solutions with transaction complexities, which aligns with strategic planning.",wos-ai,65,20,A transaction cost approach for public procurement,2022
"In this research, we investigate the behavior of Cronbach's coefficient alpha and its new standard error. We systematically analyze the effects of sample size, scale length, strength of item intercorrelations, and scale dimensionality. We demonstrate the beneficial effects of sample size on alpha's standard error and of scale length and the strengths of item intercorrelations (effects that are substitutes in their benefits) on both alpha and its standard error. Our findings also speak to this adage: Heterogeneity within the item covariance matrix (e.g., through multidimensionality or poor items) negatively impacts reliability by decreasing the precision of the estimation. We also examined the question of equilibrium scale length, showing the conditions for which it is optimal to add no items, or one, or multiple items to a scale. In terms of best practices, we recommend that researchers report a confidence interval or standard error along with the coefficient alpha point estimate.","Duhachek, A; Coughlan, AI; Iacobucci, D",Not identified,10.1287/mksc.1040.0097,measurement; survey research; reliability; coefficient alpha,35.0,,10,35,INFORMS,The abstract discusses statistical analysis and reliability measurement rather than marketing or strategic decision-making. It does not fit well into any of the defined categories.,wos-ai,10,10,Results on the standard error of the coefficient alpha index of reliability,2005
"Purpose: The analysis of the content of publications concerning decision-making processes in an enterprise indicates that one of the tasks of modern management is to identify effective solutions based on the synergy of human and technological resources that support decision-making processes. This also applies to marketing, which is subject to virtualization related both to its concept and instruments, as well as marketing activities. The purpose of the paper is to show the role of artificial intelligence and human talent in decision making in the field of marketing in an enterprise. Design/methodology/approach: Critical literature review; the research procedure that is based on the review of the literature is focused on formulating the answers to the following questions: - What factors determine the effective implementation of artificial intelligence as a technology supporting decision-making processes in the sphere of marketing in enterprises? - What are the identified models of application of artificial intelligence and human talent in making decisions in enterprises? Findings: The use of the opportunities offered by artificial intelligence in supporting marketing decisions brings many benefits, but it also requires overcoming mental and cultural barriers. It should be emphasized that relying on artificial intelligence in decision-making processes does not mean eliminating people, especially the talented ones, because it is the employee who can revise the decision-making criteria or state that the algorithm on the basis of which decisions are made in the company is outdated. Research limitations/implications: Empirical verification of the proposed model would allow for identifying the role performed by talented employees and algorithms in decision-making processes in the era of development of innovative IT solutions along with determination of the hierarchy of factors stimulating these processes. Originality/value: Proposing a model of determinants and types of solutions that allow for effectively combining human resources described as talent and artificial intelligence in making decisions in the field of marketing in enterprises is the result of the considerations provided in the paper.","Sobocinska, M",Strategic,10.7172/1644-9584.91.5,talent; artificial intelligence; machine learning; marketing,5.0,,10,0,"UNIV WARSAW, FAC MANAGEMENT","The abstract discusses the role of artificial intelligence and human talent in decision-making processes in marketing, indicating a focus on long-term strategies and the integration of technology and human resources to achieve effective decision-making. It emphasizes the need for a model that combines these elements, which aligns with strategic planning.",wos-artificial intelligence,60,25,Artificial Intelligence and Human Talent in Decision Making in the Sphere of Marketing in an Enterprise,2021
"Artificial Intelligence is a disruptive technology developed during the 20th century, which has undergone an accelerated evolution, underpinning solutions to complex problems in the business world. Neural Networks, Machine Learning, or Deep Learning are concepts currently associated with terms such as digital marketing, decision making, industry 4.0 and business digital transformation. Interest in this technology will increase as the competitive advantages of the use of Artificial Intelligence by economic entities is realised. The aim of this research is to analyse the state-of-the-art research of Artificial Intelligence in business. To this end, a bibliometric analysis has been implement using the Web of Science and Scopus online databases. By using a fractional counting method, this paper identifies 11 clusters and the most frequent terms used in Artificial Intelligence research. The present study identifies the main trends in research on Artificial Intelligence in business and proposes future lines of inquiry.","Ruiz-Real, JL; Uribe-Toril, J; Torres, JA; De Pablo, J",Strategic,10.3846/jbem.2020.13641,artificial intelligence; business; economics; bibliometrics; research trends; decision-making,5.0,,10,5,VILNIUS GEDIMINAS TECH UNIV,"The abstract discusses the state-of-the-art research of Artificial Intelligence in business, focusing on long-term trends, competitive advantages, and future lines of inquiry, which aligns with strategic planning.",wos-artificial intelligence,60,20,ARTIFICIAL INTELLIGENCE IN BUSINESS AND ECONOMICS RESEARCH: TRENDS AND FUTURE,2021
"This study, through a bibliometric analysis, aims to provide increased knowledge of the evolution and effects of artificial intelligence over the last 30 years in customer engagement and advertising engagement. Articles were gathered from three databases by using combinations of keywords (artificial intelligence, customer engagement, advertising engagement, marketing, machine learning, etc.). A set of inclusion/exclusion criteria were then applied to obtain the final sample. The final sample was made up of 190 peer-reviewed articles. Three separate analyses were performed to test the sample. A performance analysis identified the articles' years of publication, contributions per country and the performance/output of the relevant journals. A data analysis created 10 clusters; these are examined in depth, and provide explanations of the evolution of the relevant scientific production. The study's findings offer a wide perspective of research undertaken to date, and identify possible research gaps. This research contributes to the marketing field by bridging a gap, through undertaking a bibliometric analysis, in the research about the impact of artificial intelligence on customer and advertising engagement over the years 1991 through 2022. It offers scholars and researchers ideas for future research.","Suraña-Sánchez, C; Aramendia-Muneta, ME",Strategic,10.1111/ijcs.13027,advertising engagement; artificial intelligence; customer engagement; machine learning; marketing,5.0,,10,0,WILEY,"The study provides insights into the long-term evolution and effects of artificial intelligence on customer and advertising engagement, identifying research gaps and offering perspectives that inform future research directions in the marketing field.",wos-artificial intelligence,70,15,Impact of artificial intelligence on customer engagement and advertising engagement: A review and future research agenda,2024
