Title,Authors,Year,DOI,Abstract,Keywords,Publisher,Source,Classification,Reasons,Strategic,Tactical,Operational,Out of Scope,Not Identified
UAV-multispectral and vegetation indices in soybean grain yield prediction based on in situ observation,da Silva E.E.; Rojo Baio F.H.; Ribeiro Teodoro L.P.; da Silva Junior C.A.; Borges R.S.; Teodoro P.E.,2020,10.1016/j.rsase.2020.100318,"Remote sensing techniques using vegetation indices (VI's) have successfully enabled the accurate and timely monitoring of several crops. The purpose of this monitoring is to provide an advantage in terms of on-farm management decision making, crop marketing planning, and support for policy decision-making. We identified here which VI's can be used to predict soybean grain yield (GY) by using UAV (Unmanned Aerial Vehicle) and remote multispectral sensor. For this purpose, experiments were carried out in three sites during the 2017/2018 and 2018/2019 crop seasons in Brazil. The VI's were measured together with the plant stand assessment at 25 days after emergency (DAE) when the plants were at V4 phenological stage. The processing of the VI models was performed based on the imaging reflectance factor data performed in the field. For statistical data analyses, a correlation network was used to express the relationship between GY and VI's graphically. Path analysis was performed for identifying the cause-and-effect relationship between VI's and GY. Subsequently, a decision tree algorithm was generated considering GY as a dependent variable. At last, the relative deviation coefficient was used to illustrate the differences between the VI's in the construction of the decision tree and GY. Our results showed potential for predicting soybean yield based on UAV and the multispectral sensor coupled. SAVI and NDVI indices stood out for predicting yield, where the regions with the highest values of these indices can obtain the highest yield observed in the field, providing an advantage in management at the property level. © 2020 Elsevier B.V.",Decision tree; Glycine max; Path analysis; Precision agriculture; Spatial variability,Elsevier B.V.,scopus-prediction,Tactical,"The abstract discusses the use of vegetation indices (VIs) to predict soybean grain yield, which represents a tactical decision-making process. It focuses on actionable insights derived from data analysis to improve management decisions at the farm level.",15,70,10,0,5
The moderating effect of psychological factors on consumer of electric and hybrid vehicles' response purchase decisions,Rahahleh A.H.; Moflih M.A.; Alabaddi Z.A.; AL-Nsour S.N.,2020,10.5267/j.msl.2020.1.015,"This research provides an analysis and evaluation of consumer purchasing behavior using green electronic marketing of vehicles diversification into new markets, focusing on Electrical Vehicles (Ev) and Hybrid Vehicles (Hv). The world has been making remarkable efforts to make everything green and cleaner by the help of the advanced technology, including transportation. The technology especially the E marketing, social media, etc. focuses on orienting people to believe that hybrid and electrical vehicles generate less pollution, will save money and reduce dependence on natural sources of fuel. This research aims to inspect the relationship between Stimuli Factors, Electrical Vehicles' (Ev) and Hybrid Vehicles' (Hv) Consumers and Response Purchase Decisions (S-O-R), in addition to inspect the moderation effects of Psychological Inputs on S-O-R relationship in Vehicle industry of Jordan. The current research used quantitative method to gather accessible data from the sample of the study. Variables used in this study include HVs & EVs consumers, Stimuli factors (marketing inputs, external environment) and positive psychological inputs and response purchase decisions. Partial Least Squares (PLS) approach as a statistical method was used to analyze the data. Results indicate that all the relations had a positive significant, except the interactional relationship between Stimuli factors which includes marketing inputs, external environment, and positive psychological inputs, affect response purchase decisions. In other words, the mediation (HVs & EVs consumers) shows valuable change for the prediction of response purchase decisions while, moderated effect of psychological inputs did not make change. © 2020 by the authors; licensee Growing Science, Canada. This is an open access article distributed under the terms and conditions of the Creative Commons Attribution (CC-BY) license (http://creativecommons.org/licenses/by/4.0/).",Electrical Vehicles' (Ev) and Hybrid; Green Electronic Marketing; Psychological inputs; Response Purchase Decisions; S-O-R model; Stimuli Factors; Vehicles' (Hv) Consumers,Growing Science,scopus-prediction,Tactical,"The research primarily analyzes consumer purchasing behavior and the impact of marketing stimuli on purchase decisions, which aligns with tactical marketing decisions. It focuses on structured targets related to marketing inputs and consumer responses in the vehicle industry.",15,65,15,0,5
Designing an adaptive neuro fuzzy inference system for prediction of customers satisfaction,Neshat M.; Pourahmad A.A.; Hasani M.R.,2016,10.1142/S0219649216500374,"Nowadays, in order to succeed in business and presence in the world markets, it is essential to outperform the competitors to get bigger market share. To get customers satisfaction of products is the first stage of success in business. Studying the different factors involved in increasing the level of customer's satisfaction and researching in this field has caused development in several companies. In this paper, an adaptive neuro-fuzzy inference system (ANFIS) and a fuzzy inference system (FIS) are designed for marketing mix model. By using the P4 principle (price, product, place, promotion) and by combining it with the marketing experts' knowledge, good results were achieved using ANFIS. This system as an advisor with high accuracy can reduce the human errors and play a significant role in decision making by corporate managers. The results of two systems were compared and it was seen that ANFIS had a better performance than FIS with mean accuracies of 98.6% and 87.25%, respectively. © 2016 World Scientific Publishing Co.",adaptive neuro fuzzy inference system; Fuzzy decision; fuzzy expert system; marketing model,World Scientific Publishing Co. Pte Ltd,scopus-prediction,Tactical,"The abstract discusses the implementation of an adaptive neuro-fuzzy inference system (ANFIS) and a fuzzy inference system (FIS) for improving marketing mix decisions. This involves structured decision-making related to marketing analytics and product strategies, which align with tactical decision-making.",20,60,15,0,5
Estimating the importance of consumer purchasing criteria in digital ecosystems,Peláez J.I.; Cabrera F.E.; Vargas L.G.,2018,10.1016/j.knosys.2018.07.023,"The purchasing process consists of multiple, non-isolated phases that describe the interactions between consumers and products. One of these phases is the evaluation of alternatives, in which the consumer compares the benefits that will be obtained from each product or service depending on a set of criteria. Recently, the rise of online ecosystems has fueled the development of new purchasing-decision prediction models (PDPM) based on the shared opinions, concerns, and expectations of customers. Commonly, these PDPMs are constructed as multiple criteria decision analysis (MCDA) methods, where experts ascertain the consumer's purchasing criteria, as well as the importance of them, by means of surveys and their own experience. Although relying on experts may be appropriate for identifying criteria, this approach is not suitable for assessing the importance of said criteria due to the large volume of information available on the Web. Furthermore, the preferences of consumers in online ecosystems evolve constantly. In this regard, we consider that the information about purchase-criteria importance should be derived exclusively from the opinions of consumers. However, the attitude and thought-process leading to purchases contain inherent relationships that consumers are not able to express explicitly; consequently, we explore the possibility to make use of the synergies between criteria along user preferences. This paper proposes a new PDPM that estimates the importance of the criteria and values the alternatives by only considering the opinions expressed by consumers in digital ecosystems, while using an expert-defined set of criteria. The proposed approach extracts the weights of both criteria and alternatives and determines the implicit synergies within them without the need of additional input. Lastly, it uses the Choquet integral for weight and valuation aggregation and determines a purchase ranking. This model has been tested in real examples, obtaining satisfactory results. © 2018",Aggregation operators; Choquet integral; Marketing; Sentiment analysis; Synergy criteria,Elsevier B.V.,scopus-prediction,Tactical,"The abstract discusses a purchasing-decision prediction model (PDPM) that focuses on evaluating alternatives based on consumer opinions and criteria. This aligns with tactical decision-making, as it interprets strategic goals into structured targets related to consumer behavior and purchase predictions.",10,70,15,0,5
Entrepreneurial and ethical adoption behaviour of cloud computing,Ratten V.,2012,10.1016/j.hitech.2012.06.006,"In light of continuing use and media attention placed on cloud computing, the study of ethical behaviour in technology innovations remains an important area of research, which helps to understand the antecedents of a person's intention to adopt cloud computing based on their ethical orientation. The present study examines how ethics influences a person's decision to adopt cloud computing, and how in turn ethical behaviours affect technology innovations. Based on social cognitive theory, this paper proposes that a higher ethical and entrepreneurial orientation will lead to a person adopting cloud computing. Moreover, the marketing, learning and outcome expectancy a person has about cloud computing will positively affect their intention to adopt this technology. The predictions are tested through a survey, which indicates that ethics and marketing are important determinants of a person's behavioural intention towards technology innovations. © 2012 Elsevier Inc. All rights reserved.",Cloud computing; Entrepreneurship; Ethics; Learning; Social cognitive theory; Technology marketing,,scopus-prediction,Strategic,"The study examines ethical behavior and its influence on the intention to adopt cloud computing, which aligns with long-term organizational goals and the broader implications of technology adoption.",60,25,10,0,5
The impact of online product reviews on product returns,Sahoo N.; Dellarocas C.; Srinivasan S.,2018,10.1287/isre.2017.0736,"Although many researchers in information systems and marketing have studied the effect of product reviews on sales, few have looked at their effect on product returns. We hypothesize that, by reducing product uncertainty, product reviews affect the probability of product returns. We elaborate this hypothesis starting with an analytical model that examines how changes in valence and precision of information from product reviews influence the purchase and return probabilities of risk-averse, but rational, consumers. We then empirically test our hypotheses using a transaction-level data set from a multichannel, multibrand North American specialty retailer. Harnessing different consumers' purchases and returns of the same products, but with varying sets of product reviews over two years, we show that the availability of more reviews and the presence of more ""helpful"" reviews, as voted by consumers, lead to fewer product returns-after controlling for customer, product, and other context-related factors. Analyzing the purchase behavior of the consumers, we find that when fewer product reviews are available, consumers buy more substitutes in conjunction with a product, potentially to mitigate their uncertainty. Purchase of substitutes, in turn, leads to more product returns. Finally, leveraging a discontinuity in the displayed average ratings, we find that when products are shown with an average rating that is higher than the true rating, they are returned more often. These results support the predictions of our theoretical model-unbiased online reviews indeed help consumers make better purchase decisions, leading to lower product returns; biasing reviews upward results in more returns. The presence of online reviews has important cost implications for the firm beyond the cost of reprocessing the returns; we observe that when consumers return products, they are more likely to write online reviews and that these reviews are more negative than reviews that follow a nonreturned purchase. © 2018 INFORMS.",Product returns; Product reviews; Quality of purchase decision; Regression discontinuity,INFORMS Inst.for Operations Res.and the Management Sciences,scopus-prediction,Tactical,"The abstract discusses the impact of product reviews on purchase and return behaviors, which aligns with tactical decision-making related to marketing analytics, customer acquisition, and purchase prediction. It focuses on structured analysis of data to inform specific marketing strategies.",15,70,10,0,5
Understanding Adoption of Innovations and Behavior Change to Improve Agricultural Policy,Pannell D.; Zilberman D.,2020,10.1002/aepp.13013,"Research on the adoption of new practices and new behaviors in agriculture continues to grow and evolve, and its relevance to policy remains high. This special issue presents 10 papers that provide overviews of important aspects of the recent adoption literature, or identify gaps and opportunities in the literature. Adoption research has been innovative in a number of ways, including its recognition of adoption decision making as a process, not an event; its emphases on heterogeneity and learning; and its strong multidisciplinary flavor. There is scope for further innovation through efforts to enhance predictions of adoption, better understanding the balance between profit and non-profit motivations, and better recognizing the influence on adoption of characteristics of the innovations, not just characteristics of the potential adopters and their contexts. Opportunities for policy include effort to support women farmers' adoption of beneficial innovations in developing countries, and use of tools and approaches from marketing in public extension programs. © 2020 Agricultural and Applied Economics Association",adoption of innovations; agricultural extension; agricultural policy; behavior change; technology change,John Wiley and Sons Inc.,scopus-prediction,Out of scope,"The content of the abstract focuses on agricultural research and adoption practices, which are not related to marketing. It discusses the implications for policy and innovation in agriculture, rather than marketing strategies or applications.",0,0,0,100,0
Fare prediction websites and transaction prices: Empirical evidence from the airline industry,Mantin B.; Rubin E.,2016,10.1287/mksc.2015.0965,"The marketing and operations disciplines have increasingly accounted for the presence of strategic consumer behavior. Theory suggests that such behavior exists when consumers are able to consider future distribution of prices, and that this behavior exposes firms to intertemporal competition that results with a downward pressure on prices. However, deriving future distribution of prices is not a trivial task. Online decision support tools that provide consumers with information about future distributions of prices can facilitate strategic consumer behavior. This paper studies whether the availability of such information affects transacted prices by conducting an empirical analysis in the context of the airline industry. Studying the effect at the route level, we find significant price reduction effects as such information becomes available for a route, both in fixed-effects and difference-in-differences estimation models. This effect is consistent across the different fare percentiles and amounts to a reduction of approximately 4%–6% in transactions’ prices. Our results lend ample support to the notion that price prediction decision tools make a statistically significant economic impact. Presumably, consumers are able to exploit the information available online and exhibit strategic behavior. © 2016 INFORMS.",Airline industry; Decision support; Information availability; Revenue management; Strategic consumers,INFORMS Inst.for Operations Res.and the Management Sciences,scopus-prediction,Strategic,"The abstract discusses the impact of online decision support tools on consumer behavior and pricing strategies within the airline industry, indicating a focus on long-term strategic implications for pricing decisions and competition.",60,25,10,0,5
Semiautomated identification and classification of customer complaints,Choe P.; Lehto M.R.; Shin G.-C.; Choi K.-Y.,2013,10.1002/hfm.20325,"This paper examines the feasibility of extracting useful information from customer comments using a Naïve Bayes classifier. This was done for a database, obtained from a large Korean mobile telephone service provider, of 533 customer calls to call centers in 2009. After eliminating calls not containing customer complaints or comments, the remaining 383 comments were classified by an expert panel into four domains and 27 complaint categories. The four domains were Transaction-related (189 comments, 49%), Product-related (120 comments, 31%), Customer Service or Support-related (38 comments, 10%) and Customer Outreach and Marketing-related (36 comments, 9%). The comments were then randomly assigned to either a training set (257 cases, 67%) or test set (126 cases, 33%). The training set was used to develop a Naïve Bayes classifier that correctly predicted the domain 75% of the time and the specific subcategory 51% of the time for the test set. Prediction accuracy was strongly related to prediction strength for both sets of predictions, suggesting that simple filtering strategies where difficult to understand comments are flagged for expert review and easy comments are automatically classified are both technically feasible and likely to be practically valuable. Several strong predictors were also identified that corresponded to categories more detailed than those originally assigned. © 2012 Wiley Periodicals, Inc., A Wiley Company.",Bayesian inference; Call center agent; Customer complaints; Decision support; TextMiner,,scopus-prediction,Tactical,"The paper discusses the application of a Naïve Bayes classifier to analyze customer comments, which aligns with tactical decision-making in interpreting strategic goals into specific targets such as improving customer service by automating the classification of complaints.",10,70,15,0,5
"Marketing information system in citrus fruit pricing: A case study of Lattakia, Syria",Sulaiman H.; Hes T.; Kandakov A.,2015,10.5901/mjss.2015.v6n5p286,"This study focuses on the field of citrus markets in the Lattakia region, the Syrian Arab Republic. Despite the high impact of citrus production on the livelihood of more than 40,000 families in the region, citrus farmers are not informed about expected prices and market trends. This information is crucial to making successful business decisions. The main aim of the paper is the assessment of Lattakia market price dynamics and to verify the use of regression and OLS models as tools of an Agricultural Marketing Information System (AMIS) for citrus price forecasting in the Lattakia region. To this end, five indicators were applied to the data set and two models for citrus wholesale price prediction on the Lattakia markets were tested in the paper. These indicators and models were applied to empirical data, obtained from an actual Marketing Information System in the Lattakia Region. The results showed high volatility in the prices between the markets and over different months and the regression model with an index of determination R² = 0.90 was identified as suitable for seasonal price predictions (short term forecasting), while the least square method was a good tool for annual price prediction (long term). © 2015, Mediterranean Center of Social and Educational Research. All rights reserved.",AMIS; Citrus fruits; Lattakia; Marketing information system; Syria,Mediterranean Center of Social and Educational Research,scopus-prediction,Tactical,"The study involves assessing market price dynamics and forecasting citrus prices, which relates to structured decision-making and targets for farmers in the citrus market. It utilizes models for price prediction that can inform immediate business decisions.",10,70,15,0,5
Hoping grey goes green: air pollution’s impact on consumer automobile choices,Li J.; Moul C.C.; Zhang W.,2017,10.1007/s11002-016-9405-2,"This paper examines to what extent, if any, natural environmental factors affect consumer purchase decisions regarding “green” products. We collect and combine several unique datasets to study the impact of air pollution on consumers’ choices of passenger vehicles in China. Exploiting cross-city variation, we find that air pollution levels negatively affect the sales of fuel-inefficient cars on average. This relationship, though, is U-shaped over the observed air pollution levels, in that fuel-inefficient car purchases rise with air pollution beyond some threshold. Furthermore, a city’s income level is a significant factor in this non-monotonic relationship, in the sense that consumers of higher-income cities are less likely to suffer this reversal. All these results are consistent with the literature’s theoretical predictions of hope. The rich findings of our study yield important implications to both marketers and policy makers. © 2016, Springer Science+Business Media New York.",Applied industrial organization; Choice model; Consumer behavior; Environmental economics; Green marketing; Hope,Springer New York LLC,scopus-prediction,Strategic,"The paper discusses the long-term implications of natural environmental factors on consumer behavior, particularly regarding the purchase of 'green' products. It highlights the relationship between air pollution and consumer choices, which aligns with strategic planning in marketing.",60,20,15,0,5
Not Merely a Matter of Drawing Arrows: The Empirical Consequences of Measurement Model Specification and Recommendations for Practice,Chan E.K.; Sturman M.; Park S.; Vanderpool C.,2017,10.1177/1938965516686115,"Understanding measurement model specification is especially important for hospitality research due to its cross-disciplinary nature and the prevalence of measures used in the field which are often central to the formative versus reflective debate (e.g., SERVQUAL, socioeconomic status). The current study contributes to this topic by providing empirically based prescriptive advice to drive better measurement model specification. Specifically, the decision-making procedures developed by this study can complement theoretical reasons for a model choice as well as help determine a correct model choice when theories are equivocal or non-existent. This study combines actual and simulated data to show that model fit statistics alone cannot determine which model specification is correct, but also that a correct measurement model will generate more accurate predictions within a model which in turn will offer more accurate managerial recommendations. © 2017, © The Author(s) 2017.",formative measures; marketing constructs; reflective measures; simulations; structural equation modeling,SAGE Publications Inc.,scopus-prediction,Tactical,"The abstract discusses measurement model specification and the decision-making procedures that can aid in model choice, which aligns with the tactical level of interpreting strategic goals into actionable targets in hospitality research.",10,60,25,0,5
Predictive analytics - The future of data-driven social marketing,Niţu C.V.,2016,,"Given the dynamic business environment of today, companies need accurate and timely information in order to make the best decisions for the company and to respond promptly to any market changes, competitors and customers needs. The emergence and development of the Internet has changed the business model. Now, the notion of quantity and quality as the only references for the growth and development of a business, have been replaced with the visibility of the company and its products on the market. Internet will help any company to successfully promote their products and services and predict how consumers will respond in the future through predictive analytics tools. If we intend to predict how consumers will respond in the future we need to know how to use forward looking analytical. Predictive analytics provide the marketer something more than standard business reports and sales forecasts, these tools provide specific forecasts for each consumer. The forecasts include all channels, both online and offline, and predict what they intend to buy or to watch, how they will respond or what consumers will refuse. If we can provide these issues, we have control of the situation. © 2016, SRAC - Societatea Romana Pentru Asigurarea Calitatii. All rights reserved.",Business intelligence; Forecasting; Prediction; Predictive analytics,SRAC - Societatea Romana Pentru Asigurarea Calitatii,scopus-prediction,Strategic,"The abstract discusses the need for companies to utilize predictive analytics to make long-term decisions in response to market dynamics and consumer behavior, aligning with defining organizational goals and responding to market changes.",60,25,10,0,5
