Title,Authors,Year,DOI,Abstract,Keywords,Publisher,Source,Classification,Reasons,Strategic,Tactical,Operational,Out of Scope,Not Identified
Consumer attitude metrics for guiding marketing mix decisions,Hanssens D.M.; Pauwels K.H.; Srinivasan S.; Vanhuele M.; Yildirim G.,2014,10.1287/mksc.2013.0841,"Marketing managers often use consumer attitude metrics such as awareness, consideration, and preference as performance indicators because they represent their brand's health and are readily connected to marketing activity. However, this does not mean that financially focused executives know how such metrics translate into sales performance, which would allow them to make beneficial marketing mix decisions. We propose four criteria-potential, responsiveness, stickiness, and sales conversion-that determine the connection between marketing actions, attitudinal metrics, and sales outcomes. We test our approach with a rich data set of four-weekly marketing actions, attitude metrics, and sales for several consumer brands in four categories over a seven-year period. The results quantify how marketing actions affect sales performance through their differential impact on attitudinal metrics, as captured by our proposed criteria. We find that marketing-attitude and attitude-sales relationships are predominantly stable over time but differ substantially across brands and product categories. We also establish that combining marketing and attitudinal metrics criteria improves the prediction of brand sales performance, often substantially so. Based on these insights, we provide specific recommendations on improving the marketing mix for different brands, and we validate them in a holdout sample. For managers and researchers alike, our criteria offer a verifiable explanation for differences in marketing elasticities and an actionable connection between marketing and financial performance metrics. © 2014 INFORMS.",Consumer attitude metrics; Cross-effects model; Dynamic programming model; Empirical generalizations; Hierarchical linear model; Optimal marketing resource allocation; Potential; Responsiveness; Sales conversion; Stickiness,INFORMS Inst.for Operations Res.and the Management Sciences,scopus-prediction,Tactical,"The abstract discusses specific criteria for connecting marketing actions with consumer attitudes and sales performance, which aligns with tactical decision-making in marketing. The focus on quantifying the impact of marketing actions on sales and providing actionable recommendations for improving the marketing mix indicates a structured approach typical of tactical planning.",15,70,10,0,5
What Happens When Manufacturers Perform The Retailing Functions?,Li J.; Chan T.Y.; Lewis M.,2016,10.1111/poms.12549,"This study examines the effects of a relatively new channel structure on prices and sales in a large department store, which in recent years has switched the management of many of its product categories from a traditional retailer-managed system to a manufacturer-managed system. We find that the change caused overall retail prices to decrease. However, there was significant heterogeneity in the response across brands. In the cell phone category, brands with high market shares and inelastic demand did not change prices. In the watch category, the retail prices of relatively low-end brands decreased while the prices of premium brands increased substantially after the switch. In addition to sales increases due to lower prices, we find that the channel structure change further caused sales to increase by 9–10% in the cell phone category and by 11–17% in the watch category. These results are consistent with previous theoretical predictions. We believe that our results provide important academic and managerial implications due to the increasing prevalence of manufacturer-managed systems in the retail industry. © 2016 Production and Operations Management Society",channel management; decision delegation; empirical study; marketing; retailing,Wiley-Blackwell,scopus-prediction,Strategic,"The study examines the long-term effects of a new channel structure on pricing and sales, which aligns with strategic planning and decision-making about market positioning and management systems.",60,25,10,0,5
Estimating Network Effects in Two-Sided Markets,Hinz O.; Otter T.; Skiera B.,2020,10.1080/07421222.2019.1705509,"The proliferation of the Internet has enabled platform intermediaries to create two-sided markets in many industries. Time-series data on the number of customers on both sides of the markets allow platform intermediaries for estimating the direction and magnitude of network effects, which can then support growth predictions and subsequent information technology (IT) or marketing investment decisions. This article investigates the conditions under which this estimation of same-side and cross-side network effects should distinguish between its impact on the number of new customers (i.e., acquisition) and existing customers (i.e., their activity). The authors propose an influx-outflow model for doing so and conduct a simulation study to benchmark the new model against the traditional model. Further they compare the models in an illustrative empirical study in which they study the growth of an Internet auction platform. The results show that this separation of effects is beneficial because the existing customers on both sides of the market can influence the acquisition and dropout of other customers asymmetrically. The paper thus makes an important contribution that should impact the way how researchers and business practitioners measure network effects in two-sided markets. © 2020, © 2020 Taylor & Francis Group, LLC.",customer acquisition; customer churn; electronic commerce; online intermediaries; platform economy; Two-sided markets,Routledge,scopus-prediction,Strategic,"The abstract discusses the estimation of network effects in two-sided markets and its implications for long-term growth predictions and investment decisions, which aligns with strategic planning.",60,25,10,0,5
B2B: A Paradigm Shift from Economic Exchange to Behavioral Theory: A Quest for Better Explanations and Predictions,Laplaca P.; da Silva R.V.,2016,10.1002/mar.20872,"The development of industrial marketing theory has been largely characterized by descriptive approaches in the scrutiny of B2B marketing phenomena. In its pursuit for scientific legitimacy and credibility to academics and practitioners alike, research into B2B relationships as a subject of scientific enquiry will need to seriously engage into what can be termed a true paradigm shift, one that advances discovery in this area from sheer descriptive analysis and reporting to the development of explanatory schemata and theoretical frameworks of a kind that allow for more accurate prediction of underlying B2B phenomena. In doing so, theoreticians and practitioners alike will be better equipped to understand both current and emerging issues at hand as well as their implications to organizations across any geography, cultural context, or business situation. Should this be attained with some degree of success, it will mean a reduction in ambiguity accruing to the decision making of individuals in organizations, and thus a significant contribution to the overriding objective of corporate strategic planning and correspondent resource allocation. © 2016 Wiley Periodicals, Inc.",,Wiley-Liss Inc.,scopus-prediction,Strategic,The abstract discusses the need for a paradigm shift in B2B marketing research to develop explanatory frameworks that can improve understanding and prediction of B2B phenomena. This aligns with long-term strategic goals of enhancing decision-making and resource allocation in organizations.,60,20,10,0,10
Customer churns prediction in telecom using adaptive logitboost learning approach,Hemalatha M.; Mahalakshmi S.,2020,,"In telecom sector, huge amount of data is generated on daily routine owing to extensive client base. Business analysts and decision makers highlighted that including new customers seems to be costly than that of maintaining prevailing customers. Customer relationship management (CRM) and Business analysts have to recognize the cause of churn customers and to validate behavioural patterns from prevailing churn customer‘s data. This work anticipated a churn prediction model that utilizes clustering and classification approaches to recognize churn customers and to give factors that resides behind customer churning in telecom sectors. Feature selection is carried out with association attribute ranking model and weighted oversampling technique. The proposed approach initially classifies churn customers data with Adaptive Logitboost (ALB) classification algorithm for classifying the instance more appropriately. Generation of retention policies is a significant process of relationship management to eliminate churners. After performing classification approach, these model segments customers‘ data by categorization using requirement similarity matrix to acquire information gain. This model validates churn factors that are needed for determining primary cause of churn. By recognizing essential churn factors from customer data, CRM may enhance productivity by recommending appropriate promotions to set of customers based on association among behavioural patterns. Thereby, marketing campaigns are improved for the company. The anticipated churn prediction model is computed with metrics like precision, accuracy, F-measure, recall and receiving operating characteristics (ROC) area. Results depict that anticipated churn prediction provides better classification with ALB and customer profiling with requirement similarity matrix. Moreover, it provides cause of customer churning through generation of related pattern association. © 2020 IJSTR.",Association rule; Behavioural pattern; Churn customer; Prediction model; Similarity matrix,International Journal of Scientific and Technology Research,scopus-prediction,Tactical,"The abstract focuses on the development of a churn prediction model using specific methodologies, such as clustering and classification, which are aimed at addressing customer retention strategies. This aligns with tactical decision-making that interprets strategic goals into actionable targets, particularly within marketing analytics and customer engagement.",20,70,10,0,0
"Managerial decision making in customer management: Adaptive, fast and frugal?",Bauer J.C.; Schmitt P.; Morwitz V.G.; Winer R.S.,2013,10.1007/s11747-012-0320-7,"While customer management has become a top priority for practitioners and academics, little is known about how managers actually make customer management decisions. Our study addresses this gap and uses the adaptive decision maker as well as the fast and frugal heuristics frameworks to gain a better understanding of managerial decision making. Using the process-tracing tool MouselabWEB, we presented sales managers in retail banking with three typical customer management prediction tasks. The results show that a majority of managers in this study are adaptive in their decision making and that some managers use fast and frugal heuristics. Usage of adaptive decision making seems to be mainly driven by low objective task difficulty, the use of fast and frugal heuristics by experience. While adaptive decision making does not impact predictive accuracy, usage of fast and frugal heuristics is associated with proportionally greater use of high predictive quality cues and a significant increase in accuracy. Hence, the existing skepticism concerning heuristics should be questioned. © 2012 Academy of Marketing Science.",Adaptive decision making; Customer management; Fast and frugal heuristics; Mouselab; Process-tracing,,scopus-prediction,Tactical,"The study focuses on how sales managers make customer management decisions using analytical tools and heuristics, which aligns with structured decision-making at a tactical level.",10,70,15,0,5
Personal relevance and mental simulation amplify the duration framing effect,Ülkümen G.; Thomas M.,2013,10.1509/jmr.10.0172,"Different framing of the same duration (one year, 12 months, 365 days) can influence consumers' impressions of subjective duration, thereby affecting their judgments and decisions. The authors propose that, ironically, self-relevance amplifies this duration framing effect. Consumers for whom a particular self-improvement domain is personally relevant are less likely to adopt a one-year self-improvement plan as compared with a 12-month plan because they perceive it as longer and more difficult. This bias is more likely to manifest in consumers who report that the task is highly personally relevant to them, who are making predictions for themselves (vs. others), and who have high (vs. low) task involvement. Personal relevance amplifies this effect because it prompts process-focused simulation of the plan, consequently increasing susceptibility to spurious duration and difficulty cues embedded in frames. © 2013, American Marketing Association.",Duration framing; Duration perception; Mental simulation; Personal relevance; Process simulation,American Marketing Association,scopus-prediction,Tactical,"The abstract discusses how different framings of time can influence consumer behavior and decision-making, which aligns with tactical marketing efforts that focus on optimizing consumer engagement and decision processes.",10,70,15,0,5
Predicting faculty membership – application of student choice logit model,Kopanidis F.Z.; Shaw M.J.,2017,10.1108/ET-08-2015-0078,"Purpose: Educational institutions are caught between increasing their offer rates and attracting and retaining those prospective students who are most suited to course completion. The purpose of this paper is to demonstrate the influence of demographic and psychological constructs on students’ preferences when choosing to study in a particular faculty through the application and testing of a student choice logit model based on data collected from a survey of existing students. Design/methodology/approach: Logistic regression techniques were used to estimate the probability of undergraduate prospective students’ choices with reference to a set of variables that allows for the prediction and classification of students (n=304) at an Australian university. Using the estimated coefficients of both student characteristics and psychological variables, probability outputs were constructed to compute the faculty membership for student groups. Outputs were also illustrated via a set of simulation analyses. Findings: The results of the student choice logit model are highly significant suggesting demographic, socioeconomic and psychological variables play a role in the prediction of faculty membership of undergraduate students. Practical implications: These findings have implications for researchers, educational policy makers and career planners. The study also suggests that these policies should take into account the complexities of multi-attribute influences on students’ decision-making choices. Originality/value: This research offers an innovative marketing use of logistics regression techniques with application of the student choice logit model through predicting the likelihood of faculty membership in an education context. © 2017, © Emerald Publishing Limited.",Higher education; Logit model; Membership,Emerald Group Publishing Ltd.,scopus-prediction,Tactical,"The abstract discusses the application of a logit model to predict students' preferences and choices, which aligns with tactical decision-making processes that involve structured targets and analytics in an educational context.",15,70,10,0,5
Detect potential relations by link prediction in multi-relational social networks,Chen L.; Gao M.; Li B.; Liu W.; Chen B.,2018,10.1016/j.dss.2018.09.006,"Potential relation detecting on social network has become more important for decision making in many business disciplines, such as marketing, business strategy, human resources development, finance planning, business transformation, insurance policy design, and tourism management. People are used to seeking useful information from the relationships among social members to support their decisions on investment, partner seeking and marketing. Corporations are seeking opportunities to leverage them for “word of mouth” advertising based on the relations between the customers. When we collect and observe relationships between people, missing or redundant relations unavoidably occur since the time and cost restrictions in market or social investigation prevent us to discover all the relations. Moreover, since the social relations are changing constantly, current social relations may disappear, and new relations will be established. Many trade and social networks consist of multiple types of relations between the individuals. This paper presents an efficient method to detect the potential and future social relations between individuals in multi-relational social networks using link prediction. First, we calculate the belief of each individual by belief propagation on each type of relations. Based on the belief vectors, the similarities between various types of relations are computed to measure their mutual influence. Based on the similarities between various types of relations, we model link prediction as the problem of matrix completion by optimizing its max-norm constrained formulation. We propose a projected gradient descent optimization algorithm which is scalable to large size networks. Empirical results on real multi-relational social networks demonstrate that the predicting results of our algorithm have higher quality compared with other similar algorithms. © 2018",Link prediction; Matrix completion; Multi-relational social networks; Potential relations; Similarity,Elsevier B.V.,scopus-prediction,Tactical,"The abstract discusses methods for detecting potential social relations within multi-relational networks, which can inform decision-making in specific business disciplines. This aligns with tactical decision-making that interprets strategic goals into actionable targets.",20,60,15,5,0
The bias bias,Brighton H.; Gigerenzer G.,2015,10.1016/j.jbusres.2015.01.061,"In marketing and finance, surprisingly simple models sometimes predict more accurately than more complex, sophisticated models. Here, we address the question of when and why simple models succeed - or fail - by framing the forecasting problem in terms of the bias-variance dilemma. Controllable error in forecasting consists of two components, the ""bias"" and the ""variance"". We argue that the benefits of simplicity are often overlooked because of a pervasive ""bias bias"": the importance of the bias component of prediction error is inflated, and the variance component of prediction error, which reflects an oversensitivity of a model to different samples from the same population, is neglected. Using the study of cognitive heuristics, we discuss how to reduce variance by ignoring weights, attributes, and dependencies between attributes, and thus make better decisions. Bias and variance, we argue, offer a more insightful perspective on the benefits of simplicity than Occam''s razor. © 2015 .",Bias bias; Bias-variance dilemma; Occam's razor; Out-of-sample prediction; Simple heuristics; Uncertainty,Elsevier Inc.,scopus-prediction,Strategic,"The abstract discusses the bias-variance dilemma in forecasting and the benefits of simplicity in predictive models, which aligns with long-term strategic planning and decision-making in marketing and finance.",60,20,10,5,5
Environmental considerations in the purchase decisions of Ghanaian consumers,Opoku R.; Famiyeh S.; Kwarteng A.,2020,10.1108/SRJ-11-2016-0206,"Purpose: By relying on the Theory of Planned Behavior, this paper aims to understand the relative importance of attitude, subjective norm (SN), behavioral control, self-identity (SI) and past behavior in the prediction of green purchase behavior among Ghanaian consumers. Design/methodology/approach: In total, 306 graduate students were surveyed on the environmental considerations in their purchase behavior using hierarchical multiple regression analysis. Findings: The results of the study indicate that, in general, attitude and SI are more important than SN in influencing green purchase intention in a collectivistic country, such as Ghana. Yet, most respondents were neutral in their responses to questions as to whether they are green consumers and/or if they consider themselves to be concerned about environmental issues. Originality/value: This is the first attempt to study environmental consideration in purchase decisions in Ghana, a resource-rich, emerging and one of the strongest economies in sub-Saharan Africa. © 2019, Emerald Publishing Limited.",Environment; Ghana; Green consumer; Green marketing; Sub-Saharan Africa; Theory of planned behaviour,Emerald Group Holdings Ltd.,scopus-prediction,Not identified,"The abstract discusses the determinants of green purchase behavior in Ghana without providing clear implications for strategic, tactical, or operational marketing decisions.",10,15,5,0,70
(De)marketing to manage consumer quality inferences,Miklós-Thal J.; Zhang J.,2013,10.1509/jmr.11.0432,"Savvy consumers attribute a product's market performance to its intrinsic quality as well as the seller's marketing push. The authors study how sellers should optimize their marketing decisions in response. They find that a seller can benefit from ""demarketing"" its product, meaning visibly toning down its marketing efforts. Demarketing lowers expected sales ex ante but improves product quality image ex post, as consumers attribute good sales to superior quality and lackluster sales to insufficient marketing. The authors derive conditions under which demarketing can be a recommendable business strategy. A series of experiments confirm these predictions. © 2013, American Marketing Association.","Analytical modeling; Demarketing, observational learning; New product adoption; Quality inference",American Marketing Association,scopus-prediction,Strategic,"The abstract discusses how sellers can optimize their marketing decisions in response to product performance, which involves long-term strategic planning regarding marketing efforts and product quality perception. It focuses on overall marketing strategy and positioning rather than specific campaigns or operational details.",60,25,10,0,5
Revisiting optimal cutoff score determination in direct marketing using BLINEX loss: Bayesian decisive prediction approach,Levy M.S.; Wen D.; Chakilam V.; Wang H.-Y.,2016,10.1080/01966324.2016.1173607,"We develop a method to predict an optimal cutoff point from an ascending list of potential customer activation scores tomaximize profit in a future direct marketing campaign. The scoring model is based upon attributes available froma database. Our Bayesian predictive decision theoretic solution is based on two features: (1) a three-parameter bounded, asymmetric loss function BLINEX that has a higher penalty for failure to choose good prospects rather than including too many bad prospects; and (2) a Bayesian nonstandard t-predictive distribution for a future optimal score derived from normal-gamma likelihood function with unknown mean and variance based on data consisting of past optimal activation scores together with a four-parameter conjugate prior. The parameters of the BLINEX loss are also derived from past data. A comparison of BLINEX derived profits with those fromtraditional squared error loss is made via a fractional factorial experimental design with a half-normal analysis. It shows that our method is far superior based on predicted profit and that, of all parameters, the BLINEX asymmetry and prior mean are the most influential main effects. © 2016 Taylor and Francis Group, LLC.",Bayesian decision theory; Bayesian prediction; BLINEX loss; Predictive inference; Scoring models,Taylor and Francis Ltd.,scopus-prediction,Tactical,"The abstract describes a method for predicting an optimal cutoff point for customer activation scores to maximize profit in a marketing campaign, which aligns with structured decision-making processes typical of tactical actions in marketing.",10,75,10,0,5
