Abstract,Authors,Classification,DOI,Keywords,Not Identified,Not identified,Operational,Out of Scope,Publisher,Reasons,Source,Strategic,Tactical,Title,Year
"Can artificial intelligence (AI) assist human employees in increasing employee creativity? Drawing on research on AI-human collaboration, job design, and employee creativity, we examine AI assistance in the form of a sequential division of labor within organizations: in a task, AI handles the initial portion, which is well-codified and repetitive, and employees focus on the subsequent portion, involving higher-level problem-solving. First, we provide causal evidence from a field experiment conducted at a telemarketing company. We find that AI assistance in generating sales leads, on average, increases employees' creativity in answering customers' questions during subsequent sales persuasion. Enhanced creativity leads to increased sales. However, this effect is much more pronounced for higher-skilled employees. Next, we conducted a qualitative study using semi-structured interviews with the employees. We found that AI assistance changes job design by intensifying employees' interactions with more serious customers. This change enables higher-skilled employees to generate innovative scripts and develop positive emotions at work, which are conducive to creativity. By contrast, with AI assistance, lower-skilled employees make limited improvements to scripts and experience negative emotions at work. We conclude that employees can achieve AI-augmented creativity, but this desirable outcome is skill-biased by favoring experts with greater job skills.","Jia, N; Luo, XM; Fang, Z; Liao, CC",Tactical,10.5465/amj.2022.0426,,5.0,,15,0,ACAD MANAGEMENT,"The abstract discusses AI assistance in enhancing employee creativity and performance in a specific context (telemarketing), which aligns with tactical decision-making aimed at achieving structured targets and optimizing processes.",wos-ai,10,70,WHEN AND HOW ARTIFICIAL INTELLIGENCE AUGMENTS EMPLOYEE CREATIVITY,2024
"PurposeMachine learning (ML) techniques are increasingly important in enabling business-to-business (B2B) companies to offer personalized services to business customers. On the other hand, humans play a critical role in dealing with uncertain situations and the relationship-building aspects of a B2B business. Most existing studies advocating human-ML augmentation simply posit the concept without providing a detailed view of augmentation. Therefore, the purpose of this paper is to investigate how human involvement can practically augment ML capabilities to develop a personalized information system (PIS) for business customers.Design/methodology/approachThe authors developed a research framework to create an integrated human-ML PIS for business customers. The PIS was then implemented in the energy sector. Next, the accuracy of the PIS was evaluated using customer feedback. To this end, precision, recall and F1 evaluation metrics were used.FindingsThe computed figures of precision, recall and F1 (respectively, 0.73, 0.72 and 0.72) were all above 0.5; thus, the accuracy of the model was confirmed. Finally, the study presents the research model that illustrates how human involvement can augment ML capabilities in different stages of creating the PIS including the business/market understanding, data understanding, data collection and preparation, model creation and deployment and model evaluation phases.Originality/valueThis paper offers novel insight into the less-known phenomenon of human-ML augmentation for marketing purposes. Furthermore, the study contributes to the B2B personalization literature by elaborating on how human experts can augment ML computing power to create a PIS for business customers.","Yaghtin, S; Mero, J",Tactical,10.1108/JBIM-02-2023-0073,Machine learning; B2B personalization; Human-machine learning augmentation; Personalized marketing; Business customers; Personalized information system,5.0,,15,0,EMERALD GROUP PUBLISHING LTD,"The abstract discusses the practical implementation of machine learning techniques combined with human involvement to develop personalized information systems for business customers, which aligns with tactical decision-making in marketing and personalization.",wos-ai,10,70,Augmenting machine learning with human insights: the model development for B2B personalization,2024
"Artificial intelligence (AI) is transforming healthcare, yet little is known about how consumers experience medical AI and make decisions about using these providers for follow-up care. We take an interdisciplinary approach that combines behavioral and neuroimaging experiments to determine how anthropomorphism and personalization influence consumers' well-being and their decisions about a provider for follow-up care. Study 1 finds that, regardless of the type of medical provider used, consumers are likely to experience a heightened sense of well-being after a highly personalized medical consultation. However, regardless of whether the first interaction is highly personalized or not, they prefer follow-up visits with a human doctor, as mediated through empathy. Study 2 finds that, regardless of the type of medical provider used, the anterior cingulate cortex shows greater activation in a highly (vs. low) personalized interaction, the activation of which is also correlated with consumers' willingness to revisit that provider. Furthermore, the temporal occipital fusiform cortex shows greater activation in consultations with a human doctor (vs. medical AI), regardless of the interaction's level of personalization. The level of activation is also correlated with consumers' willingness to revisit with the initial provider. The findings suggest that medical AI cannot currently replace human doctors and that human doctors remain consumers' choice for medical consultations and treatment.","Zhang, YR; Tan, WY; Lee, EJ",Out of scope,10.1002/mar.21911,anthropomorphism; artificial intelligence; consumer neuroscience; fMRI; healthcare,,0.0,0,100,WILEY,"The abstract discusses the experience of consumers with medical AI in healthcare, which falls outside the realm of marketing applications.",wos-ai,0,0,Consumers' responses to personalized service from medical artificial intelligence and human doctors,2024
"Purpose - This paper aims to examine whether order and scale of market entry influence a new product's market and financial performance, and how marketing and R&D resources strengthen or weaken these effects. Design/methodology/approach - Through a mail survey, data were collected on a sample of 136 product launches by Spanish manufacturing firms. A moderated hierarchical regression analysis enabled the assessment of the relevance of order and scale as well as their interactions with marketing and R&D resources to explain a product's competitive position. Moreover, a mediation analysis allowed us to determine whether market entry strategy (indirectly) affects financial performance. Findings - The analyses show that pioneering firms and those entering the market with a full-scale launch achieve advantages in terms of competitive position, and that this variable mediates the relationship of order and scale with profitability. The empirical results also reveal that such advantages are conditioned by the availability of marketing and R&D resources. Practical implications - The decisions regarding order and scale of market entry are contingent. Managers involved in the planning of a new product launch should be knowledgeable about their firm's resources and capabilities before determining when and how to enter the market. Originality/value - Many papers study the effects of order-of-entry on market share, but other dimensions of a new product launch strategy, such as scale, have largely been ignored. The research examines the effects of both variables on competitive position and profitability. This is also one of the first studies that explores the moderating effect exerted by resources and capabilities in the launch strategy-performance relationship.","Rodríguez-Pinto, J; Gutiérrez-Cillán, J; Rodríguez-Escudero, AI",Strategic,10.1108/03090560710737633,market entry; new products; competitive strategy; profit; Spain,5.0,,10,0,EMERALD GROUP PUBLISHING LIMITED,"The paper discusses the long-term implications of market entry strategies on competitive position and financial performance, which aligns with strategic planning and decision-making at the organizational level.",wos-ai,60,25,"Order and scale of market entry, firm resources, and performance",2007
"The study focuses on understanding consumer behavior in the pet food market, specifically the factors influencing choices between online and offline purchases. With the rise of the pet economy and digital transformation, this research addresses a gap in understanding the intricacies of consumer decision-making in this niche market. A comprehensive survey was conducted targeting pet owners and potential consumers to explore the impact of factors like price, logistics, service, and quality on consumer behavior. Key findings highlight the significant influence of price sensitivity on consumers' choices. Competitive prices drove online purchases, with consumers often seeking cost-effective options. Convenience and efficiency also played pivotal roles; faster shipping and efficient logistics favored online shopping. Novel factors influencing online purchases included logistics packaging quality, charitable associations, trust in logistics companies, and genuine product guarantees. These findings underscore the need for businesses to focus on price competitiveness, convenience, trust-building, and customer-centric services to thrive in the digital pet food market. The research contributes theoretically by enhancing understanding of consumer behavior in the digital landscape and managerially by offering insights for businesses to optimize strategies. Future research directions include exploring technological impacts like AI and virtual reality, diving deeper into psychological mechanisms driving consumer responses, and broadening the sample to include diverse age groups. This study enriches the existing knowledge of consumer behavior, digital marketing, and e-commerce strategies, guiding businesses in the evolving pet economy.","Liu, ZX",Tactical,10.1007/s13132-023-01490-8,Digital economy; Consumer behavior; Pet economy; Pet food market; E-commerce; Industry 4.0,5.0,,15,0,SPRINGER,"The study provides insights into consumer behavior and decision-making processes specific to the pet food market, which can be interpreted into actionable strategies for marketing and sales. It focuses on clear factors such as price, logistics, and service, aligning with tactical-level decisions.",wos-ai,15,65,Unlocking Consumer Choices in the Digital Economy: Exploring Factors Influencing Online and Offline Purchases in the Emerging Pet Food Market,2023
"Drawing on the dynamic capability view and resource-based view, this study investigates the relationship among artificial intelligence (AI)-based partner relationship management, firm performance, and sustainable competitiveness concerning the climate management of business-to-business (B2B) firms. Throughout this investigation, the study additionally explored the impact of several other dimensions, including information communication technology capability, firm fit, and technological readiness, as fundamental requirements for the implementation of AI-based partner relationship management. The present study also investigates the relationship between firm partner engagement and firm information processing systems for climate management of B2B firms and their impact on achieving firm performance and sustainable competitiveness. A mixed-methods approach was employed that involves in-depth interviews with senior managers from a diverse set of B2B firms, and the proposed hypothesis model was evaluated by analysing the collected B2B data of 142 responses using partial least squares structural equation modelling. The findings of the study show that information communication technology capability and technological readiness play a significant role in improving the performance of AIbased partner relationship management. Furthermore, the implementation of AI-based partner relationship management in B2B firms would help partner engagement and information processing systems for climate management, leading to sustainable firm competitiveness. The outcomes of this study offer many implications for managers and practitioners in the B2B sector and suggest potential avenues for future research.","Samadhiya, A; Kumar, A; Yadav, S; Luthra, S; Jabbour, CJC; Agrawal, R",Strategic,10.1016/j.indmarman.2023.11.002,Climate change; B2B firms; Artificial intelligence; Technological readiness; Sustainable competitiveness; Performance,5.0,,10,0,ELSEVIER SCIENCE INC,"The abstract discusses the long-term implications of AI-based partner relationship management on firm performance and sustainable competitiveness in B2B firms, indicating a focus on strategic planning and organizational goals.",wos-ai,65,20,Artificial intelligence - partner relationships management for climate management in B2B firms to achieve sustainable competitiveness,2023
"Generation Z spends much time on mobile Internet and less time accessing Internet services using desktop computers. These traits make them an important niche that can be targeted by retailers. The objective of the present study is to analyze the impact of online advertising, social influence, and usage motivation on the behavioral intention related to m-commerce use among Romanian young adults. The research methodology is based on applying partial least square equation modelling (PLS-SEM), using data collected through a questionnaire. The proposed structural model includes four constructs that are first order reflective. The results reveal that among the influencing factors that determine Generation Z to use m-commerce, the usage motivation factor is the most important one, followed by social influence and online advertising. The research is useful for marketing professionals and retailers in establishing marketing strategies in accordance with the factors that influence the buying decision of young adults, representing Generation Z.","Meghisan-Toma, GM; Puiu, S; Florea, NM; Meghisan, F; Doran, D",Tactical,10.3390/jtaer16050082,mobile commerce; generation Z; e-commerce; usage motivation; behavioral intention; online advertising; social influence; m-commerce,5.0,,15,0,MDPI,"The study focuses on analyzing factors influencing m-commerce use among Generation Z, which involves interpreting strategic goals into actionable targets for marketing professionals and retailers.",wos-ai,10,70,Generation Z' Young Adults and M-Commerce Use in Romania,2021
"We study the problem a diagnostic expert (e.g., a physician) faces when offering a diagnosis to a client (e.g., a patient) that may be based only on the expert's own diagnostic ability or supplemented by a diagnostic test-conventional and artificial intelligence (AI) tools alike-revealing the client's true condition. The expert's diagnostic ability (or type) is private information. The expert is impurely altruistic in that the expert cares about both the client's utility and the expert's own reputational payoff that depends on the peer perception of the expert's diagnostic ability. The decision of whether to perform the test, which is costly for the client, provides the expert with an opportunity to influence that perception. We show a unique separating equilibrium exists in which the high-type expert does not resort to diagnostic testing and offers a diagnosis based only on the expert's own diagnostic ability, whereas the low-type expert performs the test. Furthermore, we establish that high-type expert may skip necessary diagnostic tests to separate them from the low-type expert. Interestingly, the effect of reputational payoff on undertesting is nonmonotonic, and the desire to appear of high type leads to undertesting only when the reputational payoff is intermediate. Our results also suggest a more altruistic expert may be more likely to engage in undertesting. Furthermore, efforts to encourage testing by providing financial incentives or by raising malpractice lawsuit concerns may, surprisingly, help fuel undertesting in the equilibrium. Our paper sheds new light on barriers to the adoption of AI tools aimed at enhancing physicians' diagnostic decision making.","Dai, TL; Singh, S",Out of scope,10.1287/mksc.2019.1201,game theory; health; undertesting; diagnostic expert; information asymmetry; artificial intelligence,,0.0,0,100,INFORMS,"The abstract discusses a diagnostic expert's decision-making process in healthcare and the implications of reputational concerns and testing on diagnostics, which is not related to marketing.",wos-ai,0,0,Conspicuous by Its Absence: Diagnostic Expert Testing Under Uncertainty,2020
"PurposeThe purpose of this study is to comprehend how AI aids marketers in engaging customers and generating value for the company by way of customer engagement (CE). CE is a popular area of research for scholars and practitioners. One area of research that could have far-reaching ramifications with regard to strengthening CE is artificial intelligence (AI). Consequently, it becomes extremely important to understand how AI is helping the marketer reach customers and create value for the firm via CE. Design/methodology/approachA detailed approach using both systematic review and bibliometric analysis was used. It involved identifying key research areas, the most influential authors, studies, journals, countries and organisations. Then, a comprehensive analysis of 50 papers was carried out in the four identified clusters through co-citation analysis. Furthermore, a content analysis of 42 articles for the past six years was also conducted. FindingsEmerging themes explored through cluster analysis are CE concepts and value creation, social media strategies, big data innovation and significance of AI in tertiary industry. Identified themes for content analysis are CE conceptualisation, CE behaviour in social media, CE role in value co-creation and CE via AI. Research limitations/implicationsCE has emerged as a topic of great interest for marketers in recent years. With the rapid growth of digital media and the spread of social media, firms are now embarking on new online strategies to promote CE (Javornik and Mandelli, 2012). In this review, the authors have thoroughly assessed multiple facets of prior research papers focused on the utilisation of AI in the context of CE. The existing research papers highlighted that AI-powered chatbots and virtual assistants offer real-time interaction capabilities, swiftly addressing inquiries, delivering assistance and navigating customers through their experiences (Cheng and Jiang, 2022; Naqvi et al., 2023). This rapid and responsive engagement serves to enrich the customer's overall interaction with the business. Consequently, this research can contribute to a comprehensive knowledge of how AI is assisting marketers to reach customers and create value for the firm via CE. This study also sheds light on both the attitudinal and behavioural aspects of CE on social media. While existing CE literature highlights the motivating factors driving engagement, the study underscores the significance of behavioural engagement in enhancing firm performance. It emphasises the need for researchers to understand the intricate dynamics of engagement in the context of hedonic products compared to utilitarian ones (Wongkitrungrueng and Assarut, 2020). CEs on social media assist firms in using their customers as advocates and value co-creators (Prahalad and Ramaswamy, 2004; Sawhney et al., 2005). A few of the CE themes are conceptual in nature; hence, there is an opportunity for scholarly research in CE to examine the ways in which AI-driven platforms can effectively gather customer insights. As per the prior relationship marketing studies, it is evident that building relationships reduces customer uncertainty (Barari et al., 2020). Therefore, by using data analysis, businesses can extract valuable insights into customer preferences and behaviour, equipping them to engage with customers more effectively. Practical implicationsThe rapid growth of social media has enabled individuals to articulate their thoughts, opinions and emotions related to a brand, which creates a large amount of data for VCC. Meanwhile, AI has emerged as a radical way of providing value content to users. It expands on a broader concept of how software and algorithms work like human beings. Data collected from customer interactions are a major prerequisite for efficiently using AI for enhancing CE. AI not only reduces error rates but, at the same time, helps human beings in decision-making during complex situations. Owing to built-in algorithms that analyse large amounts of data, companies can inspect areas that require improvement in real time. Time and resources can also be saved by automating tasks contingent on customer responses and insights. AI enables the analysis of customer data to create highly personalised experiences. It can also forecast customer behaviour and trends, helping businesses anticipate needs and preferences. This enables proactive CE strategies, such as targeted offers or timely outreach. Furthermore, AI tools can analyse customer feedback and sentiment across various channels. This feedback can be used to make necessary improvements and address concerns promptly, ultimately fostering stronger customer relationships. AI can facilitate seamless engagement across multiple digital channels, ensuring that customers can interact with a brand through their preferred means, be it social media, email, or chat. Consequently, this research proposes that practitioners and companies can use analysis performed by AI-enabled systems on CEB, which can assist companies in exploring the extent to which each product influences CE. Understanding the importance of these attributes would assist companies in developing more memorable CE features. Originality/valueThis study examines how prominent CE and AI are in academic research on social media by identifying research gaps and future developments. This research provides an overview of CE research and will assist academicians, regulators and policymakers in identifying the important topics that require investigation.","Gupta, Y; Khan, FM",Tactical,10.1108/JM2-01-2023-0016,Artificial intelligence; Customer engagement; Social media; Value co-creation; Literature review,5.0,,15,0,EMERALD GROUP PUBLISHING LTD,"The abstract discusses how AI is utilized in customer engagement (CE) and specific strategies marketers can use to leverage AI for enhancing CE, aligning closely with tactical decision-making focused on structured targets and strategies.",wos-ai,20,60,Role of artificial intelligence in customer engagement: a systematic review and future research directions,2024
"PurposeThis study aims to investigate the factors that affect an audience's purchase decisions on a new type of social media, namely live video streaming platforms.Design/methodology/approachThis study is based on data from an online survey providing 488 valid responses. These responses are used to test the research model by employing partial least squares (PLS) modeling.FindingsThree antecedents (consumer competitive arousal, gift design aesthetics and broadcaster's image) influence the audience's purchase decisions (impulse buying and continuous buying intention). Chinese impression management (mianzi) acts as a moderator. Self-mianzi, mutual mianzi and other mianzi (i.e. three subtypes of mianzi) moderate the effects of consumer competitive arousal, gift design aesthetics and broadcaster's image on impulse buying.Practical implicationsThe findings encourage practitioners developing marketing strategies for live video streaming platforms in the Chinese cultural context to consider peer influence, gift appearance, broadcaster's image and mianzi.Originality/valueDrawing on the community gift-giving model and face-negotiation theory, this study provides an integrated research model to investigate a new type of social media (live video streaming). It offers insight into virtual gifting behaviors by confirming the effects of three antecedents on the audience's purchase decisions, with mianzi acting as a moderator.","Hsieh, JK; Kunz, WH; Wu, AY",Tactical,10.1108/INTR-09-2021-0691,Social media; Live video streaming; Gift-giving behavior; Virtual gifts; Mianzi,5.0,,15,0,EMERALD GROUP PUBLISHING LTD,"The study investigates specific factors that influence purchase decisions on live video streaming platforms, making it more focused on targeted marketing strategies rather than overarching organizational goals.",wos-ai,10,70,Virtual gifting behavior on new social media: the perspectives of the community gift-giving model and face-negotiation theory,2023
