Abstract,Authors,Classification,DOI,Keywords,Not Identified,Not identified,Operational,Out of Scope,Publisher,Reasons,Source,Strategic,Tactical,Title,Year
"The article has dealt with the current trends of communication aspects of company's relations with the customers. The emphasis is placed on the necessity to review the companies' marketing strategies, in particular, due to communication constraints and the corresponding changes in the format of both direct and feedback with the customers. Restrictive measures have changed the format of competition, having created the conditions for its concentration in cyberspace. Changes in the nature of interpersonal communication predetermined by the limited personal activity and the introduction of remote forms of interaction, have generated demand for innovative ways of communication with customers. Other factors that require the adjustment of marketing strategies include the emergence of new behavioral capabilities of consumers associated with the intensive development of digital communication channels. It has been noted that in the digital communication environment, digital platforms provide the main format of communication with the existing customer base and potential customers. In addition, prompt acquisition and processing of data on purchasing behavior of customers allows companies to increase significantly the sensitivity of marketing research and optimize their own marketing decisions. Among the areas of increasing targeting and personalization of product offerings, the use of elements of artificial intelligence and voice search has been accentuated. Moreover, the use of artificial intelligence greatly facilitates and simplifies the work of marketers on the processing and initial analysis of the growing flow of digital marketing data, as well as provides greater efficiency. It has been concluded that widespread use of voice assistants in e-commerce requires companies to rethink radically their approaches to internal data processing, IT investment and customer engagement strategies. Active integration of chatbots into various communication platforms is able to make them universal tools for both business and consumers, which will allow them to become a familiar part of the user experience. Implementation of virtual reality and augmented reality elements in the interface of company websites can significantly diversify the process of collecting information by users and push them to unplanned purchases. It has been indicated that the growing standards of personalization and new rules of customer confidentiality will continue to require companies to be flexible and introduce new technologies in order to adapt permanently their business to new conditions. Focusing on building trust with customers based on digital communications will enable companies to create a long-term integrated marketing strategy and concentrate on the multi-channel nature of customer experience.","Hnoievyi, VH; Koren, OM",Strategic,10.32342/2074-5354-2021-1-54-5,marketing strategy; digital marketing; innovations; personalization; digital channels; artificial intelligence; voice search; virtual reality; augmented reality,5.0,,10,0,ALFRED NOBEL UNIV,The abstract discusses the need for companies to rethink their marketing strategies and adapt to changes in customer communication and behavior. This indicates a long-term planning approach to achieving organizational goals in the context of evolving market dynamics.,wos-artificial intelligence,60,25,MODERN DIGITAL MARKETING TRENDS AND THEIR INFLUENCE ON THE MARKETING STRATEGY FORMATION,2021
"PurposeThis work aims to examine the communication on Twitter of the most responsible companies in Spain to identify the topics covered on corporate social responsibility (CSR) from the perspective of happiness and social marketing. In addition, the profiles of the messages that show an association with the impact of the messages have been identified.Design/methodology/approachAn empirical analysis of the Twitter posts of Spain's ten most responsible companies has been carried out. The methodology of this work combines data mining techniques, sentiment analysis and content analysis, both from a quantitative and qualitative approach.FindingsThe results show that most brand tweets do not deal with CSR-related topics. The topics they address the most are those related to sports and the weather. From the perspective of social marketing, conversational-type tweets are the most published and have achieved the most significant reaction from the public. In addition, four messages' profiles have been identified based on the company and the emotional connotation associated with the impact, giving rise to more outstanding promotion of social causes.Originality/valueOur main contribution to this work has been to value positive communication and social marketing to promote better CSR on Twitter. In this sense, it has been verified that there is a relationship between the public's reaction, the affective connotation and the company that issues the messages.","Galiano-Coronil, A; Montero, AA; Sanchez, JAL; Ortega, RD",Tactical,10.1108/MD-01-2023-0099,Happiness; Social marketing; Twitter; Corporate social responsibility,5.0,,15,0,EMERALD GROUP PUBLISHING LTD,"The abstract discusses the analysis of Twitter communication from responsible companies in Spain, focusing on specific messages and their emotional impact, which relates to structured decision-making in social marketing and user engagement. This aligns with tactical marketing activities that translate strategic goals into actionable targets.",wos-artificial intelligence,10,70,"Exploring social responsibility, social marketing and happiness using artificial intelligence, automated text analysis and correspondence analysis",2024
"The emergence of artificial intelligence technologies, such as recommendation agents, presents new challenges and opportunities for marketing. Recommendation agents assist consumers in their online grocery shopping decisions by analyzing data on preferences and behaviors. This research highlights that while recommendation agents can reduce choice overload and make purchase decisions easier for consumers, they are also associated with higher uncertainty in decision-making. Three experimental studies confirmed that purchases aided by recommendation agents are perceived as more uncertain and reduced perceptions of control over the choices explain this outcome. Furthermore, lower choice satisfaction and purchase intentions are confirmed as consequences of perceived uncertainty. Personal characteristics such as risk aversion and maximization tendencies are considered boundary conditions for these effects.","Rohden, SF; Espartel, LB",Operational,10.1007/s10660-024-09808-7,Smart retailing; Artificial intelligence; Choice overload; Maximization tendencies; Risk perception,10.0,,60,0,SPRINGER,"The abstract discusses the use of recommendation agents in online grocery shopping, focusing on day-to-day consumer decision-making and the management of choices influenced by AI technology.",wos-artificial intelligence,10,20,Consumer reactions to technology in retail: choice uncertainty and reduced perceived control in decisions assisted by recommendation agents,2024
"Purpose The transition to omnichannel retail is the recognized future of retail, which uses digital technologies (e.g. augmented reality shopping assistants) to enhance the customer shopping experience. However, retailers struggle with the implementation of such technologies in brick-and-mortar stores. Against this background, the present study investigates the impact of a smartphone-based augmented reality shopping assistant application, which uses personalized recommendations and explainable artificial intelligence features on customer shopping experiences. Design/methodology/approach The authors follow a design science research approach to develop a shopping assistant application artifact, evaluated by means of an online experiment (n = 252), providing both qualitative and quantitative data. Findings Results indicate a positive impact of the augmented reality shopping assistant application on customers' perception of brick-and-mortar shopping experiences. Based on the empirical insights this study also identifies possible improvements of the artifact. Research limitations/implications This study's assessment is limited to an online evaluation approach. Therefore, future studies should test actual usage of the technology in brick-and-mortar stores. Contrary to the suggestions of established theories (i.e. technology acceptance model, uses and gratification theory), this study shows that an increase of shopping experience does not always convert into an increase in the intention to purchase or to visit a brick-and-mortar store. Additionally, this study provides novel design principles and ideas for crafting augmented reality shopping assistant applications that can be used by future researchers to create advanced versions of such applications. Practical implications This paper demonstrates that a shopping assistant artifact provides a good opportunity to enhance users' shopping experience on their path-to-purchase, as it can support customers by providing rich information (e.g. explainable recommendations) for decision-making along the customer shopping journey. Originality/value This paper shows that smartphone-based augmented reality shopping assistant applications have the potential to increase the competitive power of brick-and-mortar retailers.","Zimmermann, R; Mora, D; Cirqueira, D; Helfert, M; Bezbradica, M; Werth, D; Weitzl, WJ; Riedl, R; Auinger, A",Tactical,10.1108/JRIM-09-2021-0237,Digital retail; Digital shopping assistant; Recommender systems; Explainable artificial intelligence; Retail sales,5.0,,15,0,EMERALD GROUP PUBLISHING LTD,"The study focuses on the development and evaluation of a smartphone-based augmented reality shopping assistant application, which aligns with tactical decision-making as it interprets strategic goals into practical implementations and targets for enhancing customer shopping experiences.",wos-artificial intelligence,15,65,Enhancing brick-and-mortar store shopping experience with an augmented reality shopping assistant application using personalized recommendations and explainable artificial intelligence,2023
"Up to the present, various methods such as data mining, machine learning, and artificial intelligence have been used to get the best assessment from huge and important data resources. Deep learning, one of these methods, is an extended version of artificial neural networks. Within the scope of this study, a model has been developed to classify the success of tele-marketing with different machine learning algorithms, especially with deep learning algorithms. Naive Bayes, C5.0, Extreme Learning Machine, and Deep Learning algorithms have been used for modelling. To examine the effect of class label distribution on model success, synthetic minority oversampling technique has been used. The results have revealed the success of deep learning and decision trees algorithms. When the data set was not balanced, the deep learning algorithm performed better in terms of sensitivity. Among all models, the best performance in terms of accuracy, precision, and F-score have been achieved with the C5.0 algorithm.","Koçoglu, FÖ; Esnaf, S",Tactical,10.4018/IJBAN.298014,Class Label Distribution; Classification; Decision Trees; Deep Learning; Deep Neural Network; Machine Learning; Tele-Marketing Banking,5.0,,10,0,IGI GLOBAL,"The abstract discusses the development of a model to classify tele-marketing success using various machine learning algorithms. This aligns with tactical decision-making, which translates strategic goals into specific targets and structured decisions, such as improving campaign effectiveness through advanced analytics.",wos-artificial intelligence,15,70,Machine Learning Approach and Model Performance Evaluation for Tele-Marketing Success Classification,2022
"Undoubtedly, customer relationship management has gained its importance through the statement that acquiring a new customer is several times more costly than retaining and selling additional products to existing customers. Consequently, marketing practitioners are currently often focusing on retaining customers for as long as possible. However, recent findings in relationship marketing literature have shown that large differences exist within the group of long-life customers in terms of spending and spending evolution. Therefore, this paper focuses on introducing a measure of a customer's future spending evolution that might improve relationship marketing decision making. In this study, from a marketing point of view, we focus on predicting whether a newly acquired customer will increase or decrease his/her future spending from initial purchase information. This is essentially a classification task. The main contribution of this study lies in comparing and evaluating several Bayesian network classifiers with statistical and other artificial intelligence techniques for the purpose of classifying customers in the binary classification problem at hand. Certain Bayesian network classifiers have been recently proposed in the artificial intelligence literature as probabilistic white-box classifiers which allow to give a clear insight into the relationships between the variables of the domain under study. We discuss and evaluate several types of Bayesian network classifiers and their corresponding structure learning algorithms. We contribute to the literature by providing experimental evidence that: (1) Bayesian network classifiers offer an interesting and viable alternative for our customer lifecycle slope estimation problem; (2) the Markov Blanket concept allows for a natural form of attribute selection that was very effective for the application at hand; (3) the sign of the slope can be predicted with a powerful and parsimonious general, unrestricted Bayesian network classifier; (4) a set of three variables measuring the volume of initial purchases and the degree to which customers originally buy in different categories, are powerful predictors for estimating the sign of the slope, and might therefore provide desirable additional information for relationship marketing decision making. (C) 2003 Elsevier B.V. All rights reserved.","Baesens, B; Verstraeten, G; Van den Poel, D; Egmont-Petersen, M; Van Kenhove, P; Vanthienen, J",Tactical,10.1016/s0377-2217(03)00043-2,artificial intelligence; Bayesian network classifiers; marketing; CRM; customer loyalty,5.0,,15,0,ELSEVIER,"The abstract focuses on predicting customer spending behavior based on initial purchase information, which aligns with tactical decision-making in marketing. It involves structured decision processes and predictive analytics to inform relationship marketing strategies.",wos-artificial intelligence,10,70,Bayesian network classifiers for identifying the slope of the customer lifecycle of long-life customers,2004
"Purpose This research set out to examine how financial advice provided by a human advisor (vs robo-advisor) influences investment intentions in a retail banking context. Design/methodology/approach In two experiments, between-subjects experimental designs were employed to test the primary hypothesis and identify the underlying causal mechanisms that influence consumer investment decisions. Findings The results from two experiments indicate consumers have more belief in financial advice provided by a human financial advisor (vs robo-advisor), when the level of involvement is high. The authors also identify customer belief in the information and the customer's perception of the bank's customer focus as the causal mechanisms that have downstream effects on investment intentions. Originality/value This research is the first to examine how financial advice received from a human advisor (vs robo-advisor) influences investment intentions in a retail banking context. Furthermore, this research identifies high involvement as a key boundary condition moderating the effects on investment intention and identifies consumer belief in the advice, as well as the bank's perceived level of customer focus as the causal mechanisms influencing investment intentions.","Northey, G; Hunter, V; Mulcahy, R; Choong, K; Mehmet, M",Tactical,10.1108/IJBM-09-2021-0439,Artificial intelligence; Banking; Trust; Customer orientation; Robo-advisor,5.0,,15,0,EMERALD GROUP PUBLISHING LTD,"The research examines how financial advice influences consumer investment intentions, fitting into tactical decision-making by interpreting strategic goals into structured actions that can directly affect customer engagement and investment behavior.",wos-artificial intelligence,10,70,Man vs machine: how artificial intelligence in banking influences consumer belief in financial advice,2022
"Competition between marketing strategies of enterprises shifts to the use of artificial intelligence and begins to be considered in the context of competition between Data Science projects. Therefore, the issue of developing methodology and building a model in a particular area is relevant, which will make the project quite effective and ensure the achievement of goals for the company. The banking services market has a certain specificity of consumer behaviour, so forming marketing strategies is a somewhat complex process. Thus, banks face the task of maintaining the loyalty of their existing customers and attracting new ones. This article aims to build a marketing strategy to attract new customers in the banking sector using Data Science tools. The result of the study is the construction of two econometric models of the different bank's credit products: cash loans and credit cards, which determine the influence of various factors on this process and helps to distribute the advertising budget between different types of advertising. Using the built model, it was determined that advertising campaigns directly affect the increase in the number of new customers in the bank and the overall growth of brand knowledge about the banking institution in society. In addition, the determined weights of each influencing factor helped form an advertising budget, which increased customer inflows by 12%, with an average ROI of 3.18. Taking all into account, the model had shown its effectiveness in organising the bank's advertising campaign when decisions were made using Data Science technologies. The results obtained based on the models give a fairly clear understanding of the factors influencing the inflow of new customers in the bank, which will model the distribution of the budget for advertising campaigns in future periods and predict their effectiveness. Competition in the country's financial sector is forcing banking institutions to use data science in their marketing activities.","Zatonatska, T; Hubska, M; Shpyrko, V",Tactical,10.21272/mmi.2022.2-11,bank; marketing activity; advertising; regression; involvement of new clients; Data Science,5.0,,15,0,"SUMY STATE UNIV, DEPT MARKETING & MANAGEMENT INNOVATIVE ACTIVITY","The abstract discusses the development of marketing strategies using Data Science tools, focusing on specific campaigns, budget allocation, and customer acquisition in the banking sector, which aligns with tactical decision-making.",wos-artificial intelligence,10,70,MARKETING STRATEGIES IN THE BANKING SERVICES SECTOR WITH THE HELP OF DATA SCIENCE,2022
"Purpose Artificial neural network (ANN) models, part of the discipline of machine learning and artificial intelligence, are becoming more popular in the marketing literature and in marketing practice. This paper aims to provide a series of tests between ANN models and competing predictive models. Design/methodology/approach A total of 46 pairs of models were evaluated in an objective model-building environment. Either logistic regression or multiple regression models were developed and then were compared to ANN models using the same set of input variables. Three sets of B2B data were used to test the models. Emphasis also was placed on evaluating small samples. Findings ANN models tend to generate model predictions that are more accurate or the same as logistic regression models. However, when ANN models are compared to multiple regression models, the results are mixed. For small sample sizes, the modeling results are the same as for larger samples. Originality/value The research contributes to the B2B marketing literature by providing a more rigorous test on ANN models using B2B data than has been conducted before.","Wilson, RD; Bettis-Outland, H",Tactical,10.1108/JBIM-01-2019-0060,Artificial neural networks; Small samples; ANN models; B2B marketing research; Model comparisons,5.0,,15,0,EMERALD GROUP PUBLISHING LTD,"The abstract discusses the evaluation of artificial neural network models compared to logistic and multiple regression models in the context of B2B marketing, indicating a focus on structured decision-making processes relevant to marketing analytics and model performance, which aligns with tactical decision-making.",wos-artificial intelligence,10,70,Can artificial neural network models be used to improve the analysis of B2B marketing research data?,2019
"Customization and personalization services are a critical success factor for Internet stores and Web service providers. This paper studies personalized recommendation techniques that suggest products or services to the customers of Internet storefronts based on their demographics or past purchasing behavior. The underlining theories of recommendation techniques are statistics, data mining, artificial intelligence, and rule-based matching. In the rule-based approach to personalized recommendation, marketing rules For personalization are usually obtained from marketing experts and used to perform inferencing based on customer data. However, it is difficult to extract marketing rules from marketing experts, and to validate and maintain the constructed knowledge base. This paper proposes a marketing rule-extraction technique For personalized recommendation on Internet storefronts using machine learning techniques, and especially decision-tree induction techniques. Using tree induction techniques, data-mining tools can generate marketing rules that match customer demographics to product categories. The extracted rules provide personalized advertisement selection when a customer visits an Internet store. An experiment is performed to evaluate the effectiveness of the proposed approach with preference scoring and random selection.","Kim, JW; Lee, BH; Shaw, MJ; Chang, HL; Nelson, M",Tactical,10.1080/10864415.2001.11044215,decision-tree induction; Internet advertising; Internet storefront; machine learning; personalization,5.0,,10,0,M E SHARPE INC,"The paper discusses personalized recommendation techniques aimed at improving marketing efforts in Internet stores, aligning with tactical decision-making focused on specific marketing strategies and customer engagement.",wos-artificial intelligence,15,70,Application of decision-tree induction techniques to personalized advertisements on Internet storefronts,2001
"Purpose Based on the data obtained from a questionnaire of 595 people, the authors explore the relative importance of consumers, checking whether socioeconomic variables influence their centrality, detecting the communities within the network to which they belong, identifying consumption patterns and checking whether there is any relationship between co-marketing and consumer choices. Design/methodology/approach A multilayer network is created from data collected through a consumer survey to identify customers' choices in seven different markets. The authors focus the analysis on a smaller kinship and cohabitation network and apply the LART network community detection algorithm. To verify the association between consumers' centrality and variables related to their respective socioeconomic profile, the authors develop an econometric model to measure their impact on consumer's degree centrality. Findings Based on 595 responses analysing individual consumers, the authors find out which consumers invest and which variables influence consumers' centrality. Using a smaller sample of 70 consumers for whom they know kinship and cohabitation relationships, the authors detect communities with the same consumption patterns and verify that this may be an adequate way to establish co-marketing strategies. Originality/value Network analysis has become a widely used technique in the extraction of knowledge on consumers. This paper's main (and novel) contribution lies in providing a greater understanding on how multilayer networks represent hidden databases with potential knowledge to be considered in business decisions. Centrality and community detection are crucial measures in network science which enable customers with the highest potential value to be identified in a network. Customers are increasingly seen as multidimensional, considering their preferences in various markets.","Fernandes, A; Gonçalves, PCT; Campos, P; Delgado, C",Tactical,10.1108/JBIM-11-2017-0266,Centrality; Co-marketing; Community detection; Multilayer networks,5.0,,15,0,EMERALD GROUP PUBLISHING LTD,"The abstract discusses the analysis of consumer choices and the application of econometric models to understand the relationship between consumers' centrality and socioeconomic variables, which aligns with tactical decision-making processes that translate strategic goals into structured targets.",wos-artificial intelligence,20,60,Centrality and community detection: a co-marketing multilayer network,2019
