Title,Authors,Year,DOI,Abstract,Keywords,Publisher,Source,Classification,Reasons,Strategic,Tactical,Operational,Out of Scope,Not Identified
David vs. Goliath: An analysis of asymmetric mixed-strategy games and experimental evidence,Amaldoss W.; Jain S.,2002,10.1287/mnsc.48.8.972.165,"Mixed strategies are widely used to model strategic situations in diverse fields such as economics, marketing, political science, and biology. However, some of the implications of asymmetric mixed-strategy solutions are counterintuitive. We develop a stylized model of patent race to examine some of these implications. In our model two firms compete to develop a product and obtain a patent. However, one firm values the patent more because of its market advantages, such as brand reputation and distribution network. Contrary to some intuition, we find that the firm that values the patent less is likely to invest more aggressively in developing the product and will also win the patent more often. We argue that the reason for these counterintuitive results is inherent in the very concept of mixed strategy solution. In a laboratory test, we examine whether subjects' behavior conforms to the equilibrium predictions. We find that the aggregate behavior of our subjects is consistent with the game-theoretic predictions. With the help of the experience-weighted attraction (EWA) learning model proposed by Camerer and Ho (1999), we show that adaptive learning can account for the investment behavior of our subjects. We find that the EWA learning model tracks the investment decisions of our subjects well, whether we hold out trials or an entire group of subjects.",Competitive strategy; Decision analysis; Experimental economics; Learning; Marketing; R & D,INFORMS Inst.for Operations Res.and the Management Sciences,scopus-prediction,Strategic,"The abstract discusses a model of competitive behavior in a patent race, which involves long-term strategic decision-making by firms regarding their investment in product development and patent acquisition. The findings highlight counterintuitive implications of mixed strategies, indicative of long-term planning and goal setting.",70,15,10,0,5
"Consumer choice processes: Search, or automatic response?",Wasson C.R.,1979,10.1007/BF02729685,"The emphasis on consumer decision models implies that purchases largely result from a deliberate conscious search. In truth, purchases of even the new are largely unconcious automatic responses (habits, perceptions, attitudes, roles, ect.). The difficulty the customer experiences in changing such automatic response patterns is the key to understanding the widely disparate rates of adoption and diffusion of successful new products. Forecasting the timing and speed of market growth is crucial for the introducer. A mistake in either direction is serious and may be disastrous. Fortunately, prediction of the expected speed of acceptance is possible once the role of these responses is understood. *** DIRECT SUPPORT *** A00BV020 00006 © 1980 Academy of Marketing Science.",,Springer-Verlag,scopus-prediction,Strategic,"The abstract discusses the importance of understanding consumer behavior and automatic responses in the context of product adoption and market growth forecasting, aligning with long-term strategic planning and decision-making.",60,20,10,0,10
Understanding investors' decisions to purchase innovative products: Drivers of adoption timing and range,Hoffmann A.O.I.; Broekhuizen T.L.J.,2010,10.1016/j.ijresmar.2010.08.002,"This paper integrates findings from marketing and finance literature to increase our understanding of consumers' decisions to purchase innovative investment products. Two different surveys administered to individual investors examine the psychological and sociological drivers of dispositional innovativeness and its effects on adoption timing and range of adoption for five new investment products. Study 1 shows that consumer psychographics (e.g., market mavenism, product-category involvement, and ambiguity intolerance) rather than socio-demographics (e.g., age, education, and risk profile) explain dispositional innovativeness and that dispositional innovativeness strongly impacts time of adoption and ownership of new investment products. Study 2 cross-validates the results of Study 1 and investigates the indirect effects of dispositional innovativeness on adoption timing through consumers' perceptions of new investment products' complexity, riskiness, and visibility (exposure to and engagement in word-of-mouth). Individuals who score high on dispositional innovativeness adopt new investment products quickly because they perceive lower complexity and greater visibility, not because they perceive lower risk. The combined results of Studies 1 and 2 show that individual investors' psychological and sociological roots systematically explain their innovative adoption behavior and indicate that - counter to standard finance predictions - they incorporate more than just risk-return trade-offs in their investment choices. © 2010 Elsevier B.V.",Consumer financial decision-making; Dispositional innovativeness; Individual investor decision-making; Marketing-finance interface; New product adoption,,scopus-prediction,Tactical,"The paper examines the psychological and sociological drivers influencing consumer decisions regarding the adoption of innovative investment products, which aligns with tactical decision-making in marketing by interpreting strategic goals into actionable insights about consumer behavior.",10,70,15,0,5
Understanding geographical markets of online firms using spatial models of customer choice,Jank W.; Kannan P.K.,2005,10.1287/mksc.1050.0145,"As the online channel matures, many firms are finding that an understanding of how their online customers' preferences and choices vary across geographical markets can be very useful. In this paper, we propose a spatial multinomial model of customer choice and illustrate how spatial modeling of choices of online customers across geographical markets provides useful insights in the context of a product mix and pricing decision of an online book publisher. The spatial multinomial model specifically accounts for the spatial correlations among customer choices among different product forms - print and PDF. The estimation results obtained using data generated from an online experiment show that the spatial model accounts for the geographical variation in many of the unobserved effects possibly due to locational differences and price sensitivities. The resultant spatial decision maps provide useful predictions as to how purchase rates vary across geographical markets as a function of the price differential between product forms, with implications for targeting customers through local market advertising, direct marketing, and cross-channel promotion. © 2005 INFORMS.",Digital products; Internet; Mixed multinomial logit; Pricing; Spatial model,,scopus-prediction,Tactical,"The abstract discusses the use of a spatial multinomial model to analyze customer choices and preferences in a specific context, focusing on product mix and pricing decisions for an online book publisher. This aligns with tactical decision-making, which interprets strategic goals into actionable targets and involves structured decision processes.",15,60,20,0,5
Productive play time: The effect of practice on consumer demand for hedonic experiences,Murray K.B.; Bellman S.,2011,10.1007/s11747-010-0205-6,"In this paper we explain how practice, prior knowledge and task difficulty interact to affect demand for hedonic experiences. As predicted by the human capital model, we propose that the key determinant of demand for hedonic experiences is the increase in performance efficiency that can be gained through practice. In addition, we argue that the nature of the effect of practice is distinctly different in hedonic consumption, compared to utilitarian consumption. Specifically, for hedonic experiences, practice allows consumers to extract greater value within a given period of time, rather than reduce the amount of time spent on a (utilitarian) task. Finally, we argue that if changes in performance efficiency across repeated hedonic experiences adhere to the power law of practice, then both prior knowledge and task difficulty will be important moderators of the main effect of practice on demand. These predictions are tested in two experiments that use an online panel to examine consumer demand for videogames. © 2010 Academy of Marketing Science.",Decision making; Experience; Hedonic products; Human capital model; Internet; Power law of practice; Prior knowledge; Utilitarian; Videogames,,scopus-prediction,Tactical,"The abstract discusses the interaction of practice, prior knowledge, and task difficulty in affecting demand for hedonic experiences in consumer behavior, specifically related to videogames. This aligns with tactical decision-making as it interprets strategic marketing goals into clear targets and structured decisions regarding consumer preferences and demand.",15,55,25,0,5
The prediction of firm's competitive response from non-market and market perspective: Evidence from China,Deng X.; Tian Z.; Fan S.; Abrar M.,2010,10.1108/20408741011082570,"PurposeThe purpose of this paper is to explore the prediction of competitive response based on the characteristics of market and non-market actions comprehensively, and develop a four-stage decision-making model of firm's competitive action, which is significant for Chinese practicing managers when formulating and implementing the strategies, and further predicting competitors' strategic choices. Design/methodology/approachThe research adopted the method of structured content analysis and carried out the survey in Chinese home appliance industry, mainly covering the largest firms, including TCL, Hisense, Changhong, Konka, Haier, and Skyworth. The method of multiple regression analysis was employed to test the hypotheses. FindingsThe results show that in order to comprehensively forecast competitor's responding behaviors, the firms could not only limit their perspective to market field but also pay attention to non-market. Additionally, in the process of dynamic interaction, the attacking or responding action is not independent and it is related significantly to another three type decisions, which are market and non-market, strategic and tactic, and collective and individual. Further, the study asserts that, in market field, tactic activity is more likely to trigger competitor's response than strategic one, while in non-market, the situation is just the opposite. Meanwhile, the study figured out that individual market attack is easier to trigger individual market and non-market response, as well as collective market response. While for non-market action, whatever it is individual or collective, both would be easy to provoke competitor's collective response. Originality/valueThe research findings extend the existing competitive interaction theory to non-market field. When forecasting competitor's choice of the competitive action, the firms could not only limit their perspective to market field but also pay attention to non-market, attaching importance to certain situation of competitor's taking such non-market action as corporate philanthropy, etc. to launch an attack or a response for gaining competitive advantage. © 2010, © Emerald Group Publishing Limited.",China; Competitive advantage; Marketing strategy,Emerald Group Publishing Ltd.,scopus-prediction,Strategic,"The abstract discusses the development of a four-stage decision-making model for predicting competitive response, which focuses on long-term strategic planning and understanding competitors' strategic choices in both market and non-market contexts. This aligns with the definition of strategic decision-making, which is about defining organizational goals and long-term plans.",70,20,5,0,5
Incorporating cannibalization models into demand forecasting,Srinivasan S.R.; Ramakrishnan S.; Grasman S.E.,2005,10.1108/02634500510612645,"Purpose - Quantitative measures are not commonly available to identify and measure product cannibalization resulting from the introduction of new products, and existing forecasting methods such as ARIMA do not xplicitly account for the phenomenon. This paper aims to present a methodology to build cannibalization effects into forecasting models as measured through product attributes. It follows on from a paper by the same authors in Vol. 23 No. 4. Design/methodology/approach - The contribution of product attributes to cannibalization is tested by a series of hypotheses, then integrated into the proposed cannibalization model. Results are compared with predictions from an ARIMA-based model and actual historical sales data. Findings - The proposed model improves on the fidelity of ARIMA-based models, by between 16 and 42 percent. Originality/value - Effective prediction of cannibalization losses will allow marketing planners to make better-informed decisions with respect to new product introduction. © Emerald Group Publishing Limited.",Forecasting; Market share; New products; Quantitative methods,,scopus-prediction,Tactical,"The abstract focuses on developing a methodology to forecast product cannibalization, which is a tactical decision related to product introduction and marketing strategies. The analysis and improvement of forecasting models align with structured decision-making processes typical at the tactical level.",15,70,10,0,5
Predicting consumer decisions to adopt mobile commerce: Cross country empirical examination between China and Malaysia,Chong A.Y.-L.; Chan F.T.S.; Ooi K.-B.,2012,10.1016/j.dss.2011.12.001,"Advancements in wireless communications have increased the number of people using mobile devices, and have accelerated the growth of mobile commerce (m-commerce). This study aims to investigate the factors that predict consumer intention to adopt m-commerce in Malaysia and China. The work extends the traditional technology acceptance model (TAM) and diffusion of innovation (DOI) model, and includes additional variables such as trust, cost, social influence, variety of services, and control variables such as age, educational level, and gender of consumers. By comparing consumers from both Malaysia and China, this research is able to form a prediction model based on two different cultural settings. Data was collected from 172 Malaysian consumers and 222 Chinese consumers, and hierarchical regression analysis was employed to test the research model. The results showed that age, trust, cost, social influence, and variety of services are able to predict Malaysian consumer decisions to adopt m-commerce. Trust, cost, and social influence can be used to predict Chinese consumer decisions to adopt m-commerce. This research confirms the need to extend the traditional TAM and DOI models when studying technology such as m-commerce. The results from this study will be useful for telecommunication and m-commerce companies in formulating marketing strategies. © 2012 Elsevier B.V. All rights reserved.",Consumer behaviour; Hierarchical regression analysis; M-commerce; Technology acceptance model (TAM),Elsevier B.V.,scopus-prediction,Tactical,"The study investigates specific factors that influence consumer intention to adopt m-commerce, focusing on detailed aspects such as trust, cost, and social influence. This aligns with tactical decision-making, where strategic goals are translated into more structured targets and analysis.",10,70,15,0,5
Is that deal worth my time? The interactive effect of relative and referent thinking on willingness to seek a bargain,Saini R.; Rao R.S.; Monga A.,2010,10.1509/jmkg.74.1.34,"Prior research on relative thinking has suggested that the willingness to seek a bargain depends not only on the absolute value of the bargain but also on the price of the product. For example, a discount of $10 seems more appealing on a product whose regular price is $20 than a product whose regular price is $60. By invoking the interactive role of consumers' reference prices, the authors delineate the specific conditions under which the same $10 discount can seem less appealing when the price is $20 than when it is $60. They present a formal model that simultaneously incorporates the effects of relative and referent thinking and yields novel predictions, which are supported in four laboratory experiments. Their results reveal that deviation from the reference price determines when relative thinking holds and when it gets reversed. Specifically, the relative-thinking effect holds when the actual price is the same as expected, it reverses when the actual price deviates from the expected price, but it emerges again when deviation from the expected price becomes extreme. The authors conclude with the theoretical and managerial implications of their findings for marketing activities, such as the allocation of sales promotion budgets © 2010, American Marketing Association.",Behavioral decision theory; Consumer behavior; Sales promotions,,scopus-prediction,Tactical,"The abstract discusses specific marketing strategies related to consumer behavior and pricing, which align with tactical decision-making in marketing activities such as sales promotions and dynamic pricing.",10,70,15,0,5
Incorporating context effects into a choice model,Rooderkerk R.P.; Van Heerde H.J.; Bijmolt T.H.A.,2011,10.1509/jmkr.48.4.767,"The behavioral literature provides ample evidence that consumer preferences are partly driven by the context provided by the set of alternatives. Three important context effects are the compromise, attraction, and similarity effects. Because these context effects affect choices in a systematic and predictable way, it should be possible to incorporate them in a choice model. However, the literature does not offer such a choice model. This study fills this gap by proposing a discrete-choice model that decomposes a product's utility into a contextfree partworth utility and a context-dependent component capturing all three context effects. Model estimation results on choice-based conjoint data involving digital cameras provide convincing statistical evidence for context effects. The estimated context effects are consistent with the predictions from the behavioral literature, and accounting for context effects leads to better predictions both in and out of sample. To illustrate the benefit from incorporating context effects in a choice model, the authors discuss how firms could utilize the context sensitivity of consumers to design more profitable product lines. © 2011, American Marketing Association.",Behavioral decision making; Choice models; Context effects; Hierarchical bayes; Product line design,American Marketing Association,scopus-prediction,Operational,"The abstract discusses a discrete-choice model that decomposes product utility into context-free and context-dependent components, which is directly related to managing consumer preferences and choice modeling. This aligns with day-to-day operational decision-making in marketing.",10,20,60,0,10
A mathematical programming model for market share prediction,Oral M.; Kettani O.,1989,10.1016/0169-2070(89)90064-2,"The primary objective of the multiattribute models in the area of marketing is to discover the way the consumers make their choice among available alternative products. Discovering the process of choice of the customers serves as a basis for many marketing decisions such as new product planning, advertising message selection, product positioning, pricing, concept testing, sales forecasting, benefit segmentation, personal selling strategy formulation, etc. The multiattribute models proposed for this purpose can be grouped into two classes: (i) models based on mathematical programming techniques, and (ii) models based on statistical techniques. The recent literature surveys indicate that the results obtained from linear programming models show greater stability and better predictive ability. In this study therefore we will concentrate only on the mathematical programming methods of estimation in general and on a new market share prediction model in particular. The main feature of the proposed model is that it recognizes the dependence of attribute weights on attribute scores through a step function. The predictive ability of the model is discussed via a hypothetical numerical example. © 1989.",Market share; Mathematical programming; Multiattribute choice,,scopus-prediction,Tactical,"The abstract discusses the use of multiattribute models in marketing to understand consumer choice, which is more aligned with tactical decision-making processes that interpret strategic goals into specific targets and actions.",15,60,20,0,5
